quotetext,character,title,author,year
Sometimes people just want to feel heard. Here’s to possibilities of friendship and connection and understanding.,,Americanah,Chimamanda Ngozi Adichie,2013
He has put a knife on the things that held us together and we have fallen apart.,,Things Fall Apart,Chinua Achebe,1958
Once upon a time that was true... but no more.,Brom,Eragon,Christopher Paolini,2003
To know who you are without any delusions or sympathy is a moment of revelation that no one experiences unscathed.,Brom,Eragon,Christopher Paolini,2003
"You don’t know what it is to reach my age, look back, and realize that you don’t remember much of it: then to look forward and know that many years still lie ahead of you...",Brom,Eragon,Christopher Paolini,2003
"It’s overwhelming. I feel as if I am living in an illusion, a dream where all things are possible.",Eragon,Eragon,Christopher Paolini,2003
What wisdom can I give people that they haven’t already learned? It’s insanity!,Eragon,Eragon,Christopher Paolini,2003
"My mind is the only sanctuary that has not been stolen from me. Men have tried to breach it before, but I've learned to defend it vigorously, for I am only safe with my innermost thoughts.",Murtagh,Eragon,Christopher Paolini,2003
It is your wyrd that shapes you. Every age needs an icon — perhaps that lot has fallen to you.,Saphira,Eragon,Christopher Paolini,2003
It's funny to see a hatchling like you beaten by the old one.,Saphira,Eragon,Christopher Paolini,2003
May the coming years bring you great happiness.,Saphira,Eragon,Christopher Paolini,2003
No hunter of the sky should end his days as prey. Better to die on the wing than pinned to the ground.,Saphira,Eragon,Christopher Paolini,2003
"The sea is emotion incarnate. It loves, hates, and weeps. It defies all attempts to capture it with words and rejects all shackles.",Saphira,Eragon,Christopher Paolini,2003
Many people have died for their beliefs... The real courage is living and suffering for what you believe.,,Eragon,Christopher Paolini,2003
People have an annoying habit of remembering things they shouldn’t.,,Eragon,Christopher Paolini,2003
The sands of time cannot be stopped. Years pass whether we will them or not… but we can remember. What has been lost may yet live on in memories.,,Eragon,Christopher Paolini,2003
I don’t want to die without any scars.,,Fight Club,Chuck Palahniuk,1996
It’s only after we’ve lost everything that we’re free to do anything.,,Fight Club,Chuck Palahniuk,1996
"The goal isn’t to live forever, the goal is to create something that will.",,Diary,Chuck Palahniuk,2009
God gives us the ugliness so we don’t take the beautiful things in life for granted.,,Ugly Love,Colleen Hoover,2014
And that’s how easy it is for a writer to pretend to be someone they aren’t.,,Verity,Colleen Hoover,2018
"The world may be mean, but people don’t have to be, not if they refuse.",,The Underground Railroad,Colson Whitehead,2016
You never know what worse luck your bad luck has saved you from.,,No Country For Old Men,Cormac McCarthy,2005
"You forget what you want to remember, and you remember what you want to forget.",,The Road,Cormac McCarthy,2006
"Human hearts are not made of stone. They can break, and heal, and beat again.",,How to Twist a Dragon's Tale,Cressida Cowell,2007
"Once I loved truly and my heart paid the price. Now let me love truly, Thor, let me love TWICE.",Humongous Hotshot the Hero,How to Ride a Dragon's Storm,Cressida Cowell,2008
Isn't fate artistic?,,How to Steal a Dragon's Sword,Cressida Cowell,2011
"A hero cannot triumph all the time. Sometimes he will be defeated, but how he faces that defeat is a test of his character.",,How to Train Your Dragon,Cressida Cowell,2011
Who says stories cannot bring things to life?,,How to Seize a Dragon's Jewel,Cressida Cowell,2012
Everything is possible. The impossible just takes longer.,,Digital Fortress,Dan Brown,1998
"But who is more ignorant? The man who cannot define lightning, or the man who does not respect its awesome power?",,Angels & Demons,Dan Brown,2000
Each of us is a God. Each of us knows all.,,Angels & Demons,Dan Brown,2000
"Each of us is now electronically connected to the globe, and yet we feel utterly alone.",,Angels & Demons,Dan Brown,2000
"Even the technology that promises to unite us, divides us. Each of us is now electronically connected to the globe, and yet we feel utterly alone.",,Angels & Demons,Dan Brown,2000
Faith is universal. Our specific methods for understanding it are arbitrary.,,Angels & Demons,Dan Brown,2000
Fear cripples faster than any implement of war.,,Angels & Demons,Dan Brown,2000
"From Santi's earthly tomb with demon's hole, Cross Rome the mystic elements unfold.",,Angels & Demons,Dan Brown,2000
"God answers all prayers, but sometimes his answer is 'no'.",,Angels & Demons,Dan Brown,2000
"God, grant me strength to accept those things I cannot change.",,Angels & Demons,Dan Brown,2000
"If it wasn't painfully difficult, you did it wrong!",,Angels & Demons,Dan Brown,2000
No love is greater than that of a father for His son.,,Angels & Demons,Dan Brown,2000
Nothing captures human interest more than human tragedy.,,Angels & Demons,Dan Brown,2000
One does not need to have cancer to analyze its symptoms.,,Angels & Demons,Dan Brown,2000
Our minds sometimes see what our hearts wish were true.,,Angels & Demons,Dan Brown,2000
Pain is part of growing up. It’s how we learn.,,Angels & Demons,Dan Brown,2000
Science tells me God must exist. My mind tells me I will never understand God.,,Angels & Demons,Dan Brown,2000
"Seek the goodness, become the goodness.",,Angels & Demons,Dan Brown,2000
Skepticism has become a virtue. Cynicism and demand for proof has become enlightened thought.,,Angels & Demons,Dan Brown,2000
Sometimes to find truth one must move mountains -Kohler,,Angels & Demons,Dan Brown,2000
"Stand tall, smile bright, and let them wonder what secrets making you laugh!",,Angels & Demons,Dan Brown,2000
The media is the right arm of anarchy.,,Angels & Demons,Dan Brown,2000
The most dangerous enemy is that which no one fears!,,Angels & Demons,Dan Brown,2000
sometimes to find truth one must move mountains -Kohler,,Angels & Demons,Dan Brown,2000
"stand tall, smile bright, and let them wonder what secrets making you laugh!",,Angels & Demons,Dan Brown,2000
the most dangerous enemy is that which no one fears!,,Angels & Demons,Dan Brown,2000
It is never too late to be wise.,,Robinson Crusoe,Daniel Defoe,1719
Nothing in life is as important as you think it is while you are thinking about it.,,"Thinking, Fast and Slow",Daniel Kahneman,2011
Last night I dreamt I went to Manderley again.,,Rebecca,Daphne du Maurier,1938
Recovering from suffering is not like recovering from a disease. Many people don’t come out healed; they come out different.,,The Road to Character,David Brooks,2015
"Travel far enough, you meet yourself.",,Cloud Atlas,David Mitchell,2004
You crazy lady with tongs!,Calcifer,Howl's Moving Castle,Diana Wynne Jones,1986
"I'm sorry. I'm done running away, now that I have something I want to protect. It's you.",Howl,Howl's Moving Castle,Diana Wynne Jones,1986
You just never stop to think!,Howl,Howl's Moving Castle,Diana Wynne Jones,1986
A heart is a heavy burden.,Sophie,Howl's Moving Castle,Diana Wynne Jones,1986
I'm the best and cleanest witch in Ingary.,Sophie,Howl's Moving Castle,Diana Wynne Jones,1986
There is only one page left to write on. I will fill it with words of only one syllable. I love. I have loved. I will love.,,I Capture the Castle,Dodie Smith,1948
"I had the epiphany that laughter was light, and light was laughter, and that this was the secret of the universe.",,The Goldfinch,Donna Tartt,2013
Forty-two.,Deep Thought,The Hitchhiker's Guide to the Galaxy,Douglas Adams,1979
"Ford, you're turning into a penguin. Stop it.",Ford Prefect,The Hitchhiker's Guide to the Galaxy,Douglas Adams,1979
A towel is about the most massively useful thing an interstellar hitchhiker can have.,,The Hitchhiker's Guide to the Galaxy,Douglas Adams,1979
"All through my life I've had this strange unaccountable feeling that something was going on in the world, something big, even sinister, and no one would tell me what it was.",,The Hitchhiker's Guide to the Galaxy,Douglas Adams,1979
Anyone who is capable of getting themselves made President should on no account be allowed to do the job.,,The Hitchhiker's Guide to the Galaxy,Douglas Adams,1979
Far out in the uncharted backwaters of the unfashionable end of the western spiral arm of the Galaxy lies a small unregarded yellow sun.,,The Hitchhiker's Guide to the Galaxy,Douglas Adams,1979
"For instance, on the planet Earth, man had always assumed that he was more intelligent than dolphins because he had achieved so much—the wheel, New York, wars and so on—whilst all the dolphins had ever done was muck about in the water having a good time. But conversely, the dolphins had always believed that they were far more intelligent than man—for precisely the same reasons.",,The Hitchhiker's Guide to the Galaxy,Douglas Adams,1979
I'd far rather be happy than right any day.,,The Hitchhiker's Guide to the Galaxy,Douglas Adams,1979
"If there's anything more important than my ego around, I want it caught and shot now.",,The Hitchhiker's Guide to the Galaxy,Douglas Adams,1979
"So long, and thanks for all the fish.",,The Hitchhiker's Guide to the Galaxy,Douglas Adams,1979
"So this is it, We are going to die.",,The Hitchhiker's Guide to the Galaxy,Douglas Adams,1979
"Space is big. You just won't believe how vastly, hugely, mind-bogglingly big it is. I mean, you may think it's a long way down the road to the chemist's, but that's just peanuts to space.",,The Hitchhiker's Guide to the Galaxy,Douglas Adams,1979
The ships hung in the sky in much the same way that bricks don't.,,The Hitchhiker's Guide to the Galaxy,Douglas Adams,1979
Time is an illusion. Lunchtime doubly so.,,The Hitchhiker's Guide to the Galaxy,Douglas Adams,1979
We demand rigidly defined areas of doubt and uncertainty!,,The Hitchhiker's Guide to the Galaxy,Douglas Adams,1979
Don’t panic.,,The Hitchhiker’s Guide to the Galaxy,Douglas Adams,1979
"The answer to the ultimate question of life, the universe and everything is 42.",,The Hitchhiker’s Guide to the Galaxy,Douglas Adams,1979
"Oh, the places you’ll go! You’ll be on your way up! You’ll be seeing great sights! You’ll join the high fliers who soar to high heights.",,"Oh, the Places You’ll Go",Dr. Seuss,1990
You have brains in your head. You have feet in your shoes. You can steer yourself any direction you choose. You’re on your own. And you know what you know. And YOU are the one who’ll decide where to go…,,"Oh, the Places You’ll Go!",Dr. Seuss,1990
"Wherever you fly, you’ll be best of the best. Wherever you go, you will top all the rest. Except when you don’t. Because, sometimes, you won’t.",,The Places You’ll Go!,Dr. Seuss,1990
Always do what you're afraid to do.,,We Were Liars,E. Lockhart,2014
Always do what you're afraid to do. I will prove myself strong when they think I am sick.,,We Were Liars,E. Lockhart,2014
Be a little kinder than you have to.,,We Were Liars,E. Lockhart,2014
"Be sad, be sorry-but don't shoulder it.",,We Were Liars,E. Lockhart,2014
"Better than chocolate, being with you last night. Silly me, I thought that nothing was better than chocolate.",,We Were Liars,E. Lockhart,2014
"But the thing that makes me really messed up is the contradiction: when I'm not hating myself, I feel righteous and victmized.",,We Were Liars,E. Lockhart,2014
Do not accept an evil you can change.,,We Were Liars,E. Lockhart,2014
He looked at you like you were the brightest planet in the galaxy.,,We Were Liars,E. Lockhart,2014
He was a person who couldn't fake a smile but smiled often.,,We Were Liars,E. Lockhart,2014
He was contemplation and enthusiasm. Ambition and strong coffee.,,We Were Liars,E. Lockhart,2014
"Here I am frozen, when I deserve to burn.",,We Were Liars,E. Lockhart,2014
"I love him, but I am not sure I like him.",,We Were Liars,E. Lockhart,2014
I suffer migraines. I do not suffer fools.,,We Were Liars,E. Lockhart,2014
"I'll be fine, they tell me. I won't die.",,We Were Liars,E. Lockhart,2014
"If you want to live where people are not afraid of mice, you must give up living in palaces.",,We Were Liars,E. Lockhart,2014
Never take a seat in the back of the room. Winners sit up front.,,We Were Liars,E. Lockhart,2014
"One day, she ventured to the palace library and was delighted to find what good company books could be.",,We Were Liars,E. Lockhart,2014
"See the world as it is, not as you wish it would be",,We Were Liars,E. Lockhart,2014
"She is sugar, curiosity, and rain.",,We Were Liars,E. Lockhart,2014
Silence is a protective coating over pain.,,We Were Liars,E. Lockhart,2014
Someone once wrote that a novel should deliver a series of small astonishments. I get the same thing spending an hour with you.,,We Were Liars,E. Lockhart,2014
"The island is ours. Here, in some way, we are young forever.",,We Were Liars,E. Lockhart,2014
The universe is seeming really huge right now. I need something to hold on to.,,We Were Liars,E. Lockhart,2014
There is not even a Scrabble word for how bad I feel.,,We Were Liars,E. Lockhart,2014
They know that tragedy is not glamorous. They know it doesn't play out in life as it does on a stage or between the pages of a book.,,We Were Liars,E. Lockhart,2014
We are liars. We are beautiful and privileged.,,We Were Liars,E. Lockhart,2014
"What if we could stop being different colors, different backgrounds, and just be in love?",,We Were Liars,E. Lockhart,2014
It is not often that someone comes along who is a true friend and a good writer.,Charlotte,Charlotte's Web,E.B. White,1952
"Why did you do all this for me? - You have been my friend, that in itself is a tremendous thing.",Charlotte,Charlotte's Web,E.B. White,1952
You have been my friend. That in itself is a tremendous thing.,Charlotte,Charlotte's Web,E.B. White,1952
If I can fool a bug I can surely fool a man. People are not as smart as bugs.,Templeton,Charlotte's Web,E.B. White,1952
It is deeply satisfying to win a prize in front of a lot of people.,Wilbur,Charlotte's Web,E.B. White,1952
"Wilbur didn't want food, he wanted love.",Wilbur,Charlotte's Web,E.B. White,1952
Don't write about Man; write about a man.,,Charlotte's Web,E.B. White,1952
Life is always a rich and steady time when you are waiting for something to happen or to hatch.,,Charlotte's Web,E.B. White,1952
"‘Why did you do all this for me?’ he asked. ‘I don’t deserve it. I’ve never done anything for you.’ ‘You have been my friend,’ replied Charlotte. ‘That in itself is a tremendous thing.’",,Charlotte’s Web,E.B. White,1952
"Whatever the present moment contains, accept it as if you had chosen it. Always work with it, not against it. Make it your friend and ally, not your enemy.",,The Power of Now,Eckhart Tolle,1997
Each time you happen to me all over again.,,The Age of Innocence,Edith Wharton,1920
Human suffering anywhere concerns men and women everywhere.,Elie,Night,Elie Wiesel,1956
To forget the dead would be akin to killing them a second time.,Elie,Night,Elie Wiesel,1956
"A true soul mate is a mirror, the person who shows you everything that is holding you back, the person who brings you to your own attention so you can change your life.",,"Eat, Pray, Love",Elizabeth Gilbert,2006
"He’s more myself than I am. Whatever our souls are made of, his and mine are the same.",Catherine Earnshaw,Wuthering Heights,Emily Brontë,1847
"I wish I were a girl again, half-savage and hardy, and free.",Catherine Earnshaw,Wuthering Heights,Emily Brontë,1847
"If all else perished, and he remained, I should still continue to be; and if all else remained, and he were annihilated, the universe would turn to a mighty stranger.",Catherine Earnshaw,Wuthering Heights,Emily Brontë,1847
"If he loved with all the powers of his puny being, he couldn't love as much in eighty years as I could in a day.",Catherine Earnshaw,Wuthering Heights,Emily Brontë,1847
"I have not broken your heart - you have broken it; and in breaking it, you have broken mine.",Heathcliff,Wuthering Heights,Emily Brontë,1847
"If you ever looked at me once with what I know is in you, I would be your slave.",Heathcliff,Wuthering Heights,Emily Brontë,1847
Treachery and violence are spears pointed at both ends; they wound those who resort to them worse than their enemies.,Heathcliff,Wuthering Heights,Emily Brontë,1847
You know that I could as soon forget you as my existence!,Heathcliff,Wuthering Heights,Emily Brontë,1847
I have to remind myself to breathe -- almost to remind my heart to beat!,,Wuthering Heights,Emily Brontë,1847
"It was not the thorn bending to the honeysuckles, but the honeysuckles embracing the thorn.",,Wuthering Heights,Emily Brontë,1847
She burned too bright for this world.,,Wuthering Heights,Emily Brontë,1847
"Whatever our souls are made of, his and mine are the same.",,Wuthering Heights,Emily Brontë,1847
"First we only want to be seen, but once we’re seen, that’s not enough anymore. After that, we want to be remembered.",,Station Eleven,Emily St. John Mandel,2014
"Destiny is not a path you blindly follow. There are still choices to be made, and sometimes the heart speaks loudest.",Leafpool,Sign of the Moon,Erin Hunter,2003
"Destiny isn't a path that any cat follows blindly. It is always a matter of choice, and sometimes the heart speaks loudest. Deep down, I always knew what I had to do, and that's why I came back to the Clan.",Leafpool,Sign of the Moon,Erin Hunter,2003
"Listen to your heart, because that's where your true destiny lies.",Leafpool,Sign of the Moon,Erin Hunter,2003
"Mistake them, and allow the past to haunt you forever. Trust in your heart and the path it shows you.",Leafpool,Sign of the Moon,Erin Hunter,2003
We all make mistakes. Some have echoes that last forever.,Littlecloud,Fading Echoes,Erin Hunter,2006
You must burn as brightly as this fire to protect your Clan. Survival is more important than the code of the medicine cats.,Raggedstar,Night Whispers,Erin Hunter,2009
"Dude, you have balls of solid adamantium, Respect.",Aech,Ready Player One,Ernest Cline,2011
Being human totally sucks most of the time.,,Ready Player One,Ernest Cline,2011
Videogames are the only thing that make life bearable.,,Ready Player One,Ernest Cline,2011
"We don't need a map because where we are going, there is no map",,Ready Player One,Ernest Cline,2011
I can’t stand it to think my life is going so fast and I’m not really living it.,,The Sun Also Rises,Ernest Hemingway,1926
"The world breaks everyone, and afterward, many are strong at the broken places.",,A Farewell to Arms,Ernest Hemingway,1929
Every day is a new day. It is better to be lucky. But I would rather be exact. Then when luck comes you are ready.,Santiago,The Old Man and the Sea,Ernest Hemingway,1952
It's silly not to hope. It's a sin.,Santiago,The Old Man and the Sea,Ernest Hemingway,1952
Let him think that I am more man than I am and I will be so.,Santiago,The Old Man and the Sea,Ernest Hemingway,1952
Luck is a thing that comes in many forms and who can recognize her?,Santiago,The Old Man and the Sea,Ernest Hemingway,1952
Now is no time to think of what you do not have. Think of what you can do with that there is.,Santiago,The Old Man and the Sea,Ernest Hemingway,1952
"Perhaps I should not have been a fisherman, but that was the thing that I was born for.",Santiago,The Old Man and the Sea,Ernest Hemingway,1952
"Take a good rest, small bird. Then go in and take your chance like any man or bird or fish.",Santiago,The Old Man and the Sea,Ernest Hemingway,1952
"But man is not made for defeat, a man can be destroyed but not defeated.",,The Old Man and the Sea,Ernest Hemingway,1952
Can't repeat the past? Why of course you can!,Jay Gatsby,The Great Gatsby,F. Scott Fitzgerald,1925
Her voice is full of money - that was the inexhaustible charm that rose and fell in it the jingle of it the cymbals' song of it.,Jay Gatsby,The Great Gatsby,F. Scott Fitzgerald,1925
Gatsby believed in the green light the orgastic future that year by year recedes before us. It eluded us then but that's no matter - tomorrow we will run faster stretch out our arms farther.,Nick Carraway,The Great Gatsby,F. Scott Fitzgerald,1925
I was within and without simultaneously enchanted and repelled by the inexhaustible variety of life.,Nick Carraway,The Great Gatsby,F. Scott Fitzgerald,1925
In my younger and more vulnerable years my father gave me some advice: Whenever you feel like criticizing anyone just remember that all the people in this world haven't had the advantages that you've had.,Nick Carraway,The Great Gatsby,F. Scott Fitzgerald,1925
They were careless people Tom and Daisy - they smashed up things and creatures and then retreated back into their money or their vast carelessness or whatever it was that kept them together.,Nick Carraway,The Great Gatsby,F. Scott Fitzgerald,1925
You're worth the whole damn bunch put together.,Nick Carraway,The Great Gatsby,F. Scott Fitzgerald,1925
"And so we beat on, boats against the current, borne back ceaselessly into the past.",,The Great Gatsby,F. Scott Fitzgerald,1925
No amount of fire or freshness can challenge what a man will store up in his ghostly heart.,,The Great Gatsby,F. Scott Fitzgerald,1925
So we beat on boats against the current borne back ceaselessly into the past.,,The Great Gatsby,F. Scott Fitzgerald,1925
The city seen from the Queensboro Bridge is always the city seen for the first time in its first wild promise of all the mystery and the beauty in the world.,,The Great Gatsby,F. Scott Fitzgerald,1925
Whenever you feel like criticizing anyone … just remember that all the people in this world haven’t had the advantages that you’ve had.,,The Great Gatsby,F. Scott Fitzgerald,1925
Might I have a bit of earth?,Mary,The Secret Garden,Frances Hodgson Burnett,1911
And the secret garden bloomed and bloomed and every morning revealed new miracles.,,The Secret Garden,Frances Hodgson Burnett,1911
"As she came closer to him she noticed that there was a clean fresh scent of heather and grass and leaves about him, almost as if he were made of them. Perhaps he lived in the mysterious garden and knew all about it.",,The Secret Garden,Frances Hodgson Burnett,1911
"At first people refuse to believe that a strange new thing can be done, then they begin to hope it can be done, then they see it can be done--then it is done and all the world wonders why it was not done centuries ago.",,The Secret Garden,Frances Hodgson Burnett,1911
"However many years she lived, Mary always felt that she should never forget that first morning when her garden began to grow.",,The Secret Garden,Frances Hodgson Burnett,1911
"I am sure there is Magic in everything, only we have not sense enough to get hold of it and make it do things for us",,The Secret Garden,Frances Hodgson Burnett,1911
I shall live forever and ever and ever. I shall find out thousands and thousands of things.,,The Secret Garden,Frances Hodgson Burnett,1911
"If you look the right way, you can see that the whole world is a garden.",,The Secret Garden,Frances Hodgson Burnett,1911
It is the sun shining on the rain and the rain falling on the sunshine...,,The Secret Garden,Frances Hodgson Burnett,1911
It made her think that it was curious how much nicer a person looked when he smiled. She had not thought of it before.,,The Secret Garden,Frances Hodgson Burnett,1911
"Much more surprising things can happen to anyone who, when a disagreeable or discouraged thought comes into his mind, just has the sense to remember in time and push it out by putting in an agreeable, determinedly courageous one. Two things cannot be in one place.",,The Secret Garden,Frances Hodgson Burnett,1911
"My mother always says people should be able to take care of themselves, even if they're rich and important.",,The Secret Garden,Frances Hodgson Burnett,1911
Never thee stop believin' in th' Big Good Thing an' knowin' th' world's full of it - and call it what tha' likes.,,The Secret Garden,Frances Hodgson Burnett,1911
Nothing in the world is quite as adorably lovely as a robin when he shows off and they are nearly always doing it.,,The Secret Garden,Frances Hodgson Burnett,1911
"Of course there must be lots of Magic in the world, but people don't know what it is like or how to make it. Perhaps the beginning is just to say nice things are going to happen until you make them happen.",,The Secret Garden,Frances Hodgson Burnett,1911
"Oh, how she did love that queer, common boy!",,The Secret Garden,Frances Hodgson Burnett,1911
One of the strange things about living in the world is that it is only now and then one is quite sure one is going to live forever.,,The Secret Garden,Frances Hodgson Burnett,1911
People never like me and I never like people. And I never can talk as the Crawford children could.,,The Secret Garden,Frances Hodgson Burnett,1911
She made herself stronger by fighting with the wind.,,The Secret Garden,Frances Hodgson Burnett,1911
"She stopped and listened to him and somehow his cheerful, friendly little whistle gave her a pleased feeling. Perhaps he lived in the mysterious garden and knew all about it.",,The Secret Garden,Frances Hodgson Burnett,1911
"So long as I know what's expected of me, I can manage.",,The Secret Garden,Frances Hodgson Burnett,1911
Sometimes since I've been in the garden I've looked up through the trees at the sky and I have had a strange feeling of being happy as if something was pushing and drawing in my chest and making me breathe fast. Magic is always pushing and drawing and making things out of nothing.,,The Secret Garden,Frances Hodgson Burnett,1911
