quotetext,character,title,author,year
"As Cuvier could correctly describe a whole animal by the contemplation of a single bone, so the observer who has thoroughly understood one link in a series of incidents should be able to accurately state all the other ones, both before and after.",Sherlock Holmes,The Adventure of the Three Garridebs,Arthur Conan Doyle,1908
"Let us hear the suspicions. I will look after the proofs.",Sherlock Holmes,The Adventure of the Three Students,Arthur Conan Doyle,1904
"We are devil-ridden, Mr. Holmes! My poor parish is devil-ridden! Satan himself is loose in it! We are given over into his hands!",Sherlock Holmes,The Adventure of the Devil's Foot,Arthur Conan Doyle,1910
"We must look for consistency. Where there is a want of it we must suspect deception.",Sherlock Holmes,The Problem of Thor Bridge,Arthur Conan Doyle,1922
"When one tries to rise above Nature one is liable to fall below it. The highest type of man may revert to the animal if he leaves the straight road of destiny.",Sherlock Holmes,The Adventure of the Lion's Mane,Arthur Conan Doyle,1926
"Education never ends, Watson. It is a series of lessons with the greatest for the last.",Sherlock Holmes,The Adventure of the Bruce-Partington Plans,Arthur Conan Doyle,1908
"Some fumes which are not poisonous would be a welcome change.",Sherlock Holmes,The Adventure of the Devil's Foot,Arthur Conan Doyle,1910
"Good old Watson! You are the one fixed point in a changing age. There's an east wind coming all the same, such a wind as never blew on England yet. It will be cold and bitter, Watson, and a good many of us may wither before its blast. But it's God's own wind none the less, and a cleaner, better, stronger land will lie in the sunshine when the storm has cleared.",Sherlock Holmes,His Last Bow,Arthur Conan Doyle,1917
"Let us hear the suspicions. I will look after the proofs.",Sherlock Holmes,The Adventure of the Three Students,Arthur Conan Doyle,1904
"Perhaps, when a man has special knowledge and special powers like my own, it rather encourages him to seek a complex explanation when a simpler one is at hand.",Sherlock Holmes,The Adventure of the Abbey Grange,Arthur Conan Doyle,1904
"Work is the best antidote to sorrow.","Sherlock Holmes","The Adventure of the Norwood Builder","Arthur Conan Doyle","1903"
"It is impossible as I state it, and therefore I must in some respect have stated it wrong.","Sherlock Holmes","The Adventure of the Priory School","Arthur Conan Doyle","1904"
"There should be no combination of events for which the wit of man cannot conceive an explanation.","Sherlock Holmes","The Valley of Fear","Arthur Conan Doyle","1915"
"I believe that I am one of the most long-suffering of mortals; but I'll admit that I was annoyed at the sardonic interruption.","Dr. Watson","The Valley of Fear","Arthur Conan Doyle","1915"
"Nowhere on all her body was sign of fault.",,"Amores","Ovid","16 BC"
"Every lover is a soldier, and Cupid has a camp of his own. 'Tis unseemly for the old man to soldier, unseemly for the old man to love.",,"Amores","Ovid","16 BC"
"Whoso would not lose all his spirit, let him love!",,"Amores","Ovid","16 BC"
"Far from us be the omen!",,"Amores","Ovid","16 BC"
"Those who have merited punishment bear it with even mind.",,"Amores","Ovid","16 BC"
"What one may do freely has no charm; what one may not do pricks more keenly on.",,"Amores","Ovid","16 BC"
"She to whom erring is free, errs less; very power makes less quick the seeds of sin.",,"Amores","Ovid","16 BC"
"We ever strive for what is forbid, and ever covet what is denied.",,"Amores","Ovid","16 BC"
"Thus I can live neither with you nor without you.",,"Amores","Ovid","16 BC"
"I can scarcely keep my hands off you!",,"Amores","Ovid","16 BC"
"Cedant carminibus reges, regumque triumphi.","","Amores","Ovid","16 BC"
"When evil fate sweeps away the good—forgive me who say it!—I am tempted to think there are no gods.",,"Amores","Ovid","16 BC"
"Time was when genius was more precious than gold; but now to have nothing is monstrous barbarism.",,"Amores","Ovid","16 BC"
"Bear and endure: some day your pains will tell.",,"Amores","Ovid","16 BC"
"If any man wish to escape idleness, let him fall in love.",,"Amores","Ovid","16 BC"
"Time glides away unnoticed, and eludes us in his flight.",,"Amores","Ovid","16 BC"
"The burden which is borne with cheerfulness becomes light.",,"Amores","Ovid","16 BC"
"I am no longer the fool I was.",,"Amores","Ovid","16 BC"
"Pleasure's a sin, and sometimes sin's a pleasure.",Narrator,Don Juan,Lord Byron,1818
"But words are things, and a small drop of ink, Falling like dew, upon a thought, produces That which makes thousands, perhaps millions, think.",Narrator,Don Juan,Lord Byron,1818
"'Tis sweet to hear the watch-dog's honest bark Bay deep-mouth'd welcome as we draw near home; 'Tis sweet to know there is an eye will mark Our coming, and look brighter when we come.",Narrator,Don Juan,Lord Byron,1821
"All who joy would win Must share it,—happiness was born a twin.",Narrator,Don Juan,Lord Byron,1819
"Let us have wine and women, mirth and laughter, Sermons and soda water the day after.",Narrator,Don Juan,Lord Byron,1819
"Man's love is of man's life a thing apart, 'Tis woman's whole existence.",Narrator,Don Juan,Lord Byron,1818
"Nothing so difficult as a beginning In poesy, unless perhaps the end.",Narrator,Don Juan,Lord Byron,1821
"The precious porcelain of human clay.",Narrator,Don Juan,Lord Byron,1821
"Perhaps the early grave Which men weep over may be meant to save.",Narrator,Don Juan,Lord Byron,1821
"But ne'ertheless I hope it is no crime To laugh at all things — for I wish to know What, after all, are all things — but a show?",Narrator,Don Juan,Lord Byron,1823
"The drying up a single tear has more Of honest fame than shedding seas of gore.",Narrator,Don Juan,Lord Byron,1823
"Not so Leonidas and Washington, Whose every battle-field is holy ground, Which breathes of nations saved, not worlds undone.",Narrator,Don Juan,Lord Byron,1823
"When Bishop Berkeley said 'there was no matter,' And proved it — 'twas no matter what he said.",Narrator,Don Juan,Lord Byron,1823
"Now hatred is by far the longest pleasure; Men love in haste, but they detest at leisure.",Narrator,Don Juan,Lord Byron,1823
"Of all tales 't is the saddest,—and more sad, Because it makes us smile.",Narrator,Don Juan,Lord Byron,1823
"'Tis strange, — but true; for truth is always strange; Stranger than fiction.",Narrator,Don Juan,Lord Byron,1823
"The Devil hath not, in all his quiver's choice, An arrow for the heart like a sweet voice.",Narrator,Don Juan,Lord Byron,1824
"A lovely being, scarcely formed or moulded, A rose with all its sweetest leaves yet folded.",Narrator,Don Juan,Lord Byron,1824
"The antique Persians taught three useful things — To draw the bow, to ride, and speak the truth.",Narrator,Don Juan,Lord Byron,1824
"But not to go too far, I hold it law, That where their education, harsh or mild, Trangresses the great bounds of love or awe, The sufferers — be't in heart or intellect — Whate'er the cause, are orphans in effect.",Narrator,Don Juan,Lord Byron,1824
"Great Galileo was debarr'd the Sun Because he fix'd it; and, to stop his talking, How Earth could round the solar orbit run, Found his own legs embargo'd from mere walking.",Narrator,Don Juan,Lord Byron,1824
"Write nothing back to me—yourself come!",,"The Heroides","Ovid",1989
"Love is a thing ever filled with anxious fear.",,"The Heroides","Ovid",1989
"Now are fields of corn where Troy once was, and soil made fertile with Phrygian blood waves rich with harvest ready for the sickle.",,"The Heroides","Ovid",1989
"We are tardy in believing, when belief brings hurt.",,"The Heroides","Ovid",1989
"The event proves well the wisdom of her course.",,"The Heroides","Ovid",1989
"What modesty forbade me to say, love has commanded me to write.",,"The Heroides","Ovid",1989
"If 'twas my fate to err, my error had honourable cause.","Dido to Æneas","The Heroides","Ovid",1989
"Tastes change into character.",,"The Heroides","Ovid",1989
"Modesty and love are not at one.",,"The Heroides","Ovid",1989
"There is virtue in abstinence from what delights.",,"The Heroides","Ovid",1989
"Judge of beauty.",,"The Heroides","Ovid",1989
"Pursuits grow into habits.",,"The Heroides","Ovid",1989
"The event justifies the deed.",,"The Heroides","Ovid",1989
"What shame forbade me speak, Love made me write.",,"The Heroides","Ovid",1989
"When once a woman’s virtue’s gone, No art the damage can atone: 'Tis ruined once for all.","Chastity","The Heroides","Ovid",1989
"You began better than you end: your last attempts must yield the palm to your previous achievements. How little does the man correspond to the promise of the boy!","Deianira reproaching Hercules","The Heroides","Ovid",1989
"If you wish to marry suitably, marry your equal.",,"The Heroides","Ovid",1989
"You are the (or a) judge of beauty.","Mercury to Paris","The Heroides","Ovid",1989
"The scythe now reaps the corn where Ilion stood, And fields that fatten on the Trojans’ blood.",,"The Heroides","Ovid",1989
"Those presents which derive their value from the donor are always the most acceptable.",,"The Heroides","Ovid",1989
"'Tis virtue to abstain from things that please.",,"The Heroides","Ovid",1989
"Confidence is slow in reposing itself in undertakings of any magnitude.",,"The Heroides","Ovid",1989
"Don’t you know that kings have long arms?",,"The Heroides","Ovid",1989
"Be both a speaker of words and a doer of deeds.",Achilles,"The Iliad",Homer,-800
"A glorious death is his who for his country falls.",Hector,"The Iliad",Homer,-800
"I have endured what no one on earth has ever done before—I put to my lips the hands of the man who killed my son.",Priam,"The Iliad",Homer,-800
"Think not to match yourself against gods, for men that walk the earth cannot hold their own with the immortals.",Unknown,"The Iliad",Homer,-800
"Victory passes back and forth between men.",Unknown,"The Iliad",Homer,-800
"Let us go on and win glory for ourselves, or yield it to others.",Sarpedon,"The Iliad",Homer,-800
"There is nothing alive more agonized than man of all that breathe and crawl across the earth.",Zeus,"The Iliad",Homer,-800
"Man, supposing you and I, escaping this battle, would be able to live on forever, ageless, immortal, so neither would I myself go on fighting in the foremost, nor would I urge you into the fighting where men win glory.",Sarpedon,"The Iliad",Homer,-800
"Locking spear by spear, shield against shield at the base, so buckler leaned on buckler, helmet on helmet, man against man.",Unknown,"The Iliad",Homer,-800
"So now I meet my doom. Well let me die—but not without struggle, not without glory, no, in some great clash of arms that even men to come will hear of down the years!",Hector,"The Iliad",Homer,-800
"We are but dust and shadow.","","Odes","Horace","13 BC"
"Never despair.","","Odes","Horace","23 BC"
"'Tis sweet and glorious to die for fatherland.","","Odes","Horace","23 BC"
"Brute force bereft of wisdom falls to ruin by its own weight.","","Odes","Horace","23 BC"
"As money grows, care and greed for greater riches follow after.","","Odes","Horace","23 BC"
"Happy the man, and happy he alone, He, who can call to day his own: He who, secure within, can say, To-morrow do thy worst, for I have lived to-day.","","Odes","Horace","23 BC"
"We are but dust and shadow.","","Odes","Horace","13 BC"
"It was a pleasure to burn.",Guy Montag,Fahrenheit 451,Ray Bradbury,1953
"If they give you ruled paper, write the other way.",,Fahrenheit 451,Ray Bradbury,1953
"Are you happy?",Mildred Montag,Fahrenheit 451,Ray Bradbury,1953
"Time has fallen asleep in the afternoon sunshine.",,Fahrenheit 451,Ray Bradbury,1953
"We have everything we need to be happy, but we aren't happy. Something's missing.",Guy Montag,Fahrenheit 451,Ray Bradbury,1953
"The good writers touch life often. The mediocre ones run a quick hand over her. The bad ones rape her and leave her for the flies.",Faber,Fahrenheit 451,Ray Bradbury,1953
"Remember the firemen are rarely necessary. The public stopped reading of its own accord.",Faber,Fahrenheit 451,Ray Bradbury,1953
"To everything there is a season. Yes. A time to break down, and a time to build up.",,Fahrenheit 451,Ray Bradbury,1953
"Stuff your eyes with wonder, live as if you'd drop dead in ten seconds. See the world.",Faber,Fahrenheit 451,Ray Bradbury,1953
"A book is a loaded gun in the house next door. Burn it.",Captain Beatty,Fahrenheit 451,Ray Bradbury,1953
"There is nothing magical in them at all. The magic is only in what books say, how they stitched the patches of the universe together into one garment for us.",Faber,Fahrenheit 451,Ray Bradbury,1953
"Everyone must leave something behind when he dies, my grandfather said. A child or a book or a painting or a house or a wall built or a pair of shoes made.",Faber,Fahrenheit 451,Ray Bradbury,1953
"Do your own bit of saving, and if you drown, at least die knowing you were headed for shore.",Faber,Fahrenheit 451,Ray Bradbury,1953
"We have everything we need to be happy, but we aren't happy. Something's missing.",Guy Montag,Fahrenheit 451,Ray Bradbury,1953
"All of them running about, putting out the stars and extinguishing the sun. You come away lost.",Faber,Fahrenheit 451,Ray Bradbury,1953
"How inconvenient! Always before it had been like snuffing a candle.",Faber,Fahrenheit 451,Ray Bradbury,1953
"Every man the image of every other; then all are happy, for there are no mountains to make them cower.",Faber,Fahrenheit 451,Ray Bradbury,1953
"Books were only one type of receptacle where we stored a lot of things we were afraid we might forget.",Faber,Fahrenheit 451,Ray Bradbury,1953
"Let him forget there is such a thing as war.",Captain Beatty,Fahrenheit 451,Ray Bradbury,1953
"With school turning out more runners, jumpers, racers, tinkerers, grabbers, snatchers, fliers, and swimmers instead of examiners, critics, knowers, and imaginative creators.",Faber,Fahrenheit 451,Ray Bradbury,1953
"We must all be alike. Not everyone born free and equal, as the Constitution says, but everyone made equal.",Captain Beatty,Fahrenheit 451,Ray Bradbury,1953
"I will be my undoing if I become my obsession.",,"Divergent","Veronica Roth","2011"
"Intelligence is a gift, not a right. It must be wielded not as a weapon but as a tool for the betterment of others.",,"Divergent","Veronica Roth","2011"
"We believe in ordinary acts of bravery, in the courage that drives one person to stand up for another.",,"Divergent","Veronica Roth","2011"
"Dishonesty is a veil that shields one person from another.",,"Divergent","Veronica Roth","2011"
"Fear doesn't shut you down; it wakes you up.",Four,"Divergent","Veronica Roth","2011"
"I used to think the Dauntless were fearless. That is how they seemed, anyway. But maybe what I saw as fearless was actually fear under control.",,"Divergent","Veronica Roth","2011"
"I will be my undoing if I become my obsession.",,"Divergent","Veronica Roth","2011"
"Does God want goodness or the choice of goodness? Is a man who chooses to be bad perhaps in some way better than a man who has the good imposed upon him?",,A Clockwork Orange,Anthony Burgess,1962
"Oh bliss, bliss and heaven... Oh, it was gorgeousness and gorgeousity made flesh...",Alex,A Clockwork Orange,Anthony Burgess,1962
"It’s funny how the colours of the real world only seem really real when you viddy them on the screen.",Alex,A Clockwork Orange,Anthony Burgess,1962
"When a man cannot choose, he ceases to be a man.",Prison Chaplain,A Clockwork Orange,Anthony Burgess,1962
"Am I just to be like a clockwork orange?",Alex,A Clockwork Orange,Anthony Burgess,1962
"There is no necessity for pain—why, then, is the worst pain reserved for those who will not accept its necessity?",Dagny Taggart,Atlas Shrugged,Ayn Rand,1957
"Contradictions do not exist. Whenever you think you are facing a contradiction, check your premises. You will find that one of them is wrong.",Francisco d'Anconia,Atlas Shrugged,Ayn Rand,1957
"Man? What is man? He's just a collection of chemicals with delusions of grandeur.",Dr. Simon Pritchett,Atlas Shrugged,Ayn Rand,1957
"I don't like people who speak or think in terms of gaining anybody's confidence. If one's actions are honest, one does not need the predated confidence of others, only their rational perception. The person who craves a moral blank check of that kind, has dishonest intentions, whether he admits it to himself or not.",Francisco d'Anconia,Atlas Shrugged,Ayn Rand,1957
"Wasn't it evil to wish without moving—or to move without aim?",Dagny Taggart,Atlas Shrugged,Ayn Rand,1957
"Don't ever get angry at a man for stating the truth.",Dagny Taggart,Atlas Shrugged,Ayn Rand,1957
"I am leaving it as I found it. Take over. It's yours.",Ellis Wyatt,Atlas Shrugged,Ayn Rand,1957
"The worst guilt is to accept an undeserved guilt.",Francisco d'Anconia,Atlas Shrugged,Ayn Rand,1957
"If you saw Atlas, the giant who holds the world on his shoulders, blood running down his chest, his knees buckling, his arms trembling but still trying to hold the world aloft with the last of his strength... To shrug.",Francisco d'Anconia,Atlas Shrugged,Ayn Rand,1957
"Have you ever felt the longing for someone you could admire? For something, not to look down at, but up to?",Dr. Robert Stadler,Atlas Shrugged,Ayn Rand,1957
"The man who lets a leader prescribe his course is a wreck being towed to the scrap heap.",John Galt,Atlas Shrugged,Ayn Rand,1957
"No one’s happiness but my own is in my power to achieve or to destroy.",John Galt,Atlas Shrugged,Ayn Rand,1957
"I swear—by my life and my love of it—that I will never live for the sake of another man, nor ask another man to live for mine.",John Galt,Atlas Shrugged,Ayn Rand,1957
"Live and act within the limit of your knowledge and keep expanding it to the limit of your life.",John Galt,Atlas Shrugged,Ayn Rand,1957
"Learn to distinguish the difference between errors of knowledge and breaches of morality. An error of knowledge is not a moral flaw... but that which you refuse to know, is an account of infamy growing in your soul.",John Galt,Atlas Shrugged,Ayn Rand,1957
"The only proper purpose of a government is to protect man's rights, which means: to protect him from physical violence. A proper government is only a policeman...",John Galt,Atlas Shrugged,Ayn Rand,1957
"The evil of the world is made possible by nothing but the sanction you give it.",John Galt,Atlas Shrugged,Ayn Rand,1957
"No sentimentality, comrade! War is war. The only good human being is a dead one.","Snowball","Animal Farm","George Orwell",1945
"Four legs good, two legs better!","","Animal Farm","George Orwell",1945
"Four legs good, two legs bad.","","Animal Farm","George Orwell",1945
"All animals are equal, but some animals are more equal than others.","","Animal Farm","George Orwell",1945
"Bravery is not enough. Loyalty and obedience are more important.","Squealer","Animal Farm","George Orwell",1945
"They teach you how to resist the enemy, how to protect your mind and spirit.","","World War Z: An Oral History of the Zombie War","Max Brooks",2006
"We relinquished our freedom that day, and we were more than happy to see it go. From that moment on we lived in true freedom.","","World War Z: An Oral History of the Zombie War","Max Brooks",2006
"Ignorance was the enemy. Lies and superstition, misinformation, disinformation.","","World War Z: An Oral History of the Zombie War","Max Brooks",2006
"I think most people would rather face the light of a real enemy than the darkness of their imagined fears.","","World War Z: An Oral History of the Zombie War","Max Brooks",2006
"Lies are neither bad nor good. Like a fire they can either keep you warm or burn you to death, depending on how they're used.","","World War Z: An Oral History of the Zombie War","Max Brooks",2006
"When you think about the CIA, you probably imagine two of our most popular and enduring myths.",Bob Archer,"World War Z: An Oral History of the Zombie War","Max Brooks",2006
"The facts were out; it was now a question of who would believe them.",Bob Archer,"World War Z: An Oral History of the Zombie War","Max Brooks",2006
"This is our system and it's the best in the world. But it must be protected, and it must never again be so abused.",Travis D'Ambrosia,"World War Z: An Oral History of the Zombie War","Max Brooks",2006
"We knew Phalanx was a placebo, and we were grateful for it. It calmed people down and let us do our job.",Grover Carlson,"World War Z: An Oral History of the Zombie War","Max Brooks",2006
"I think most people would rather face the light of a real enemy than the darkness of their imagined fears.","","World War Z: An Oral History of the Zombie War","Max Brooks",2006
"Hope, New Mexico. Hope.","","World War Z: An Oral History of the Zombie War","Max Brooks",2006
"I wonder what future generations will say about us. Maybe that's the best epitaph to hope for: 'Generation Z, they cleaned up their own mess.'","", "World War Z: An Oral History of the Zombie War","Max Brooks",2006
"One cannot cross a river without getting wet.","","World War Z: An Oral History of the Zombie War","Max Brooks",2006
"There's a word for that kind of lie. Hope.","","World War Z: An Oral History of the Zombie War","Max Brooks",2006
"I'd like to think that's not true. But if it is, then no one on Earth survived this war.","","World War Z: An Oral History of the Zombie War","Max Brooks",2006
"They must forever be an example to the rest of us, the strongest, and bravest, and absolute best of us.","","World War Z: An Oral History of the Zombie War","Max Brooks",2006
"Every one belongs to every one else.",,Brave New World,Aldous Huxley,1932
"A gramme is better than a damn.",,Brave New World,Aldous Huxley,1932
"Words can be like X-rays, if you use them properly - they'll go through anything. You read and you're pierced.",Helmholtz Watson,Brave New World,Aldous Huxley,1932
"O brave new world, O brave new world …",,Brave New World,Aldous Huxley,1932
"Actual happiness always looks pretty squalid in comparison with the over-compensations for misery. And, of course, stability isn't nearly so spectacular as instability.",Mustapha Mond,Brave New World,Aldous Huxley,1932
"One cubic centimetre cures ten gloomy sentiments.",,Brave New World,Aldous Huxley,1932
"All the advantages of Christianity and alcohol; none of their defects.",,Brave New World,Aldous Huxley,1932
"We prefer to do things comfortably.",Mustapha Mond,Brave New World,Aldous Huxley,1932
"We are not our own any more than what we possess is our own.",Mustapha Mond,Brave New World,Aldous Huxley,1932
"Happiness is a hard master – particularly other people's happiness.",The Controller,Brave New World,Aldous Huxley,1932
"I'd rather be myself. Myself and nasty. Not somebody else, however jolly.",Bernard Marx,Brave New World,Aldous Huxley,1932
"Don't you wish you were free, Lenina?",Bernard Marx,Brave New World,Aldous Huxley,1932
"Never put off till to-morrow the fun you can have to-day.",,Brave New World,Aldous Huxley,1932
"Cleanliness is next to fordliness.",,Brave New World,Aldous Huxley,1932
"O brave new world that has such people in it. Let's start at once.",,Brave New World,Aldous Huxley,1932
"Happiness has got to be paid for.",The Controller,Brave New World,Aldous Huxley,1932
"One gramme is better than a damn.",,Brave New World,Aldous Huxley,1932
"Suffer little children.",The Controller,Brave New World,Aldous Huxley,1932
"Who watches the Watchmen?","","Watchmen","Alan Moore","1987"
"My intellect set me apart. Faced with difficult choices, I knew nobody whose advice might prove useful. Nobody living.","Adrian Veidt/Ozymandias","Watchmen","Alan Moore","1987"
"The ancient world's greatest puzzle was there, a knot that couldn't be untied. Alexander cut it in two with his sword.","Adrian Veidt/Ozymandias","Watchmen","Alan Moore","1987"
"I don't mind being the smartest man in the world. I just wish it wasn't this one.","Adrian Veidt/Ozymandias","Watchmen","Alan Moore","1987"
"It doesn't take a genius to see that this world has problems.","","Watchmen","Alan Moore","1987"
"Justice is coming to all of us, no matter what we do.","The Comedian","Watchmen","Alan Moore","1987"
"Everything is preordained. Even my responses.","Doctor Manhattan","Watchmen","Alan Moore","1987"
"We gaze continually at the world and it grows dull in our perceptions. Yet seen from another's vantage point, it may still take our breath away.","Doctor Manhattan","Watchmen","Alan Moore","1987"
"Why does one death matter against so many? Because there is good and there is evil, and evil must be punished.","Rorschach","Watchmen","Alan Moore","1987"
"None of you understand. I'm not locked up in here with you. You're locked up in here with me.","Rorschach","Watchmen","Alan Moore","1987"
"I did the right thing, didn't I? It all worked out in the end.","Adrian Veidt/Ozymandias","Watchmen","Alan Moore","1987"
"Y'know, this must be how ordinary people feel around us.","Daniel Dreiberg/Nite Owl II","Watchmen","Alan Moore","1987"
"Once you realize what a joke everything is, being the Comedian is the only thing that makes sense.","The Comedian","Watchmen","Alan Moore","1987"
"A live body and a dead body contain the same number of particles. Life and death are unquantifiable abstracts.","Doctor Manhattan","Watchmen","Alan Moore","1987"
"There is no future. There is no past. Time is simultaneous.","Doctor Manhattan","Watchmen","Alan Moore","1987"
"We're all puppets, Laurie. I'm just a puppet who can see the strings.","Doctor Manhattan","Watchmen","Alan Moore","1987"
"In my opinion, the existence of life is a highly overrated phenomenon.","Rorschach","Watchmen","Alan Moore","1987"
"Humanity's savage nature will inevitably lead to global annihilation.","Adrian Veidt/Ozymandias","Watchmen","Alan Moore","1987"
