quotetext,character,title,author,year
"Whoso would not lose all his spirit, let him love!",,Amores,Ovid,16 BC
"When once a woman’s virtue’s gone, No art the damage can atone: 'Tis ruined once for all.",Chastity,The Heroides,Ovid,1989
You began better than you end: your last attempts must yield the palm to your previous achievements. How little does the man correspond to the promise of the boy!,Deianira reproaching Hercules,The Heroides,Ovid,1989
"If 'twas my fate to err, my error had honourable cause.",Dido to Æneas,The Heroides,Ovid,1989
You are the (or a) judge of beauty.,Mercury to Paris,The Heroides,Ovid,1989
'Tis virtue to abstain from things that please.,,The Heroides,Ovid,1989
Confidence is slow in reposing itself in undertakings of any magnitude.,,The Heroides,Ovid,1989
Don’t you know that kings have long arms?,,The Heroides,Ovid,1989
"If you wish to marry suitably, marry your equal.",,The Heroides,Ovid,1989
Judge of beauty.,,The Heroides,Ovid,1989
Love is a thing ever filled with anxious fear.,,The Heroides,Ovid,1989
Modesty and love are not at one.,,The Heroides,Ovid,1989
"Now are fields of corn where Troy once was, and soil made fertile with Phrygian blood waves rich with harvest ready for the sickle.",,The Heroides,Ovid,1989
Pursuits grow into habits.,,The Heroides,Ovid,1989
Tastes change into character.,,The Heroides,Ovid,1989
The event justifies the deed.,,The Heroides,Ovid,1989
The event proves well the wisdom of her course.,,The Heroides,Ovid,1989
"The scythe now reaps the corn where Ilion stood, And fields that fatten on the Trojans’ blood.",,The Heroides,Ovid,1989
There is virtue in abstinence from what delights.,,The Heroides,Ovid,1989
Those presents which derive their value from the donor are always the most acceptable.,,The Heroides,Ovid,1989
"We are tardy in believing, when belief brings hurt.",,The Heroides,Ovid,1989
"What modesty forbade me to say, love has commanded me to write.",,The Heroides,Ovid,1989
"What shame forbade me speak, Love made me write.",,The Heroides,Ovid,1989
Write nothing back to me—yourself come!,,The Heroides,Ovid,1989
"The same substance composes us — the tree overhead, the stone beneath us, the bird, the beast, the star — we are all one, all moving to the same end.",,Mary Poppins,P.L. Travers,1934
"Human knowledge is never contained in one person. It grows from the relationships we create between each other and the world, and still, it is never complete.",,When Breath Becomes Air,Paul Kalanithi,2016
"If you can concentrate always on the present, you'll be a happy man. Life is the moment we are living now.",Santiago,The Alchemist,Paulo Coelho,1988
"And, when you want something, all the universe conspires in helping you to achieve it.",,The Alchemist,Paulo Coelho,1988
It’s the possibility of having a dream come true that makes life interesting.,,The Alchemist,Paulo Coelho,1988
"When you want something, all the universe conspires in helping you to achieve it.",,The Alchemist,Paulo Coelho,1988
Even a stopped clock is right twice a day.,,Brida,Paulo Coelho,1990
"When someone leaves, it’s because someone else is about to arrive.",,The Zahir,Paulo Coelho,2005
It is sometimes an appropriate response to reality to go insane.,,Valis,Philip K. Dick,1981
The only limits for tomorrow are the doubts we have today.,,The Power of Six,Pittacus Lore,2011
"Life is to be lived, not controlled; and humanity is won by continuing to play in face of certain defeat.",,Invisible Man,Ralph Ellison,1952
"When I discover who I am, I’ll be free.",,Invisible Man,Ralph Ellison,1952
A book is a loaded gun in the house next door. Burn it.,Captain Beatty,Fahrenheit 451,Ray Bradbury,1953
Let him forget there is such a thing as war.,Captain Beatty,Fahrenheit 451,Ray Bradbury,1953
"We must all be alike. Not everyone born free and equal, as the Constitution says, but everyone made equal.",Captain Beatty,Fahrenheit 451,Ray Bradbury,1953
"All of them running about, putting out the stars and extinguishing the sun. You come away lost.",Faber,Fahrenheit 451,Ray Bradbury,1953
Books were only one type of receptacle where we stored a lot of things we were afraid we might forget.,Faber,Fahrenheit 451,Ray Bradbury,1953
"Do your own bit of saving, and if you drown, at least die knowing you were headed for shore.",Faber,Fahrenheit 451,Ray Bradbury,1953
"Every man the image of every other; then all are happy, for there are no mountains to make them cower.",Faber,Fahrenheit 451,Ray Bradbury,1953
"Everyone must leave something behind when he dies, my grandfather said. A child or a book or a painting or a house or a wall built or a pair of shoes made.",Faber,Fahrenheit 451,Ray Bradbury,1953
How inconvenient! Always before it had been like snuffing a candle.,Faber,Fahrenheit 451,Ray Bradbury,1953
Remember the firemen are rarely necessary. The public stopped reading of its own accord.,Faber,Fahrenheit 451,Ray Bradbury,1953
"Stuff your eyes with wonder, live as if you'd drop dead in ten seconds. See the world.",Faber,Fahrenheit 451,Ray Bradbury,1953
The good writers touch life often. The mediocre ones run a quick hand over her. The bad ones rape her and leave her for the flies.,Faber,Fahrenheit 451,Ray Bradbury,1953
"There is nothing magical in them at all. The magic is only in what books say, how they stitched the patches of the universe together into one garment for us.",Faber,Fahrenheit 451,Ray Bradbury,1953
"With school turning out more runners, jumpers, racers, tinkerers, grabbers, snatchers, fliers, and swimmers instead of examiners, critics, knowers, and imaginative creators.",Faber,Fahrenheit 451,Ray Bradbury,1953
"We have everything we need to be happy, but we aren't happy. Something's missing.",Guy Montag,Fahrenheit 451,Ray Bradbury,1953
Are you happy?,Mildred Montag,Fahrenheit 451,Ray Bradbury,1953
"If they give you ruled paper, write the other way.",,Fahrenheit 451,Ray Bradbury,1953
It was a pleasure to burn.,,Fahrenheit 451,Ray Bradbury,1953
Time has fallen asleep in the afternoon sunshine.,,Fahrenheit 451,Ray Bradbury,1953
"To everything there is a season. Yes. A time to break down, and a time to build up.",,Fahrenheit 451,Ray Bradbury,1953
"We cannot tell the precise moment when friendship is formed. As in filling a vessel drop by drop, there is at last a drop which makes it run over; so in a series of kindnesses there is at last one which makes the heart run over.",,Fahrenheit 451,Ray Bradbury,1953
"I set off, off to kill the man I loved.",Rose Hathaway,Vampire Academy,Richelle Mead,2007
"You can't force love. If it is there, you've got to do whatever it takes to protect the ones you love.",Rose Hathaway,Frostbite,Richelle Mead,2008
"It was memories like that that made it so hard to comprehend the quest to kill him. At the same time, I had to destroy him to remember him as the man who loved me.",Rose Hathaway,Blood Promise,Richelle Mead,2010
Even strength must bow to wisdom sometimes.,Annabeth Chase,The Lightning Thief,Rick Riordan,2005
Appearances can be deceiving.,Chiron,The Lightning Thief,Rick Riordan,2005
Humans see what they want to see.,Chiron,The Lightning Thief,Rick Riordan,2005
"Gods of Olympus, I hate it when he does that.",Percy Jackson,The Lightning Thief,Rick Riordan,2005
It's funny how humans can wrap their mind around things and fit them into their version of reality.,Percy Jackson,The Lightning Thief,Rick Riordan,2005
The real world is where the monsters are.,Percy Jackson,The Lightning Thief,Rick Riordan,2005
The sea does not like to be restrained.,Percy Jackson,The Lightning Thief,Rick Riordan,2005
"Go on with what your heart tells you, or you will lose all.",The Oracle,The Lightning Thief,Rick Riordan,2005
"If my life is going to mean anything, I have to live it myself.",,The Lightning Thief,Rick Riordan,2005
Knowing too much of your future is never a good thing.,,The Lightning Thief,Rick Riordan,2005
Families are messy. Immortal families are eternally messy. Sometimes the best we can do is to remind each other that we're related for better or for worse... and try to keep the maiming and killing to a minimum.,Hermes,The Sea of Monsters,Rick Riordan,2006
"You can't give up on your family, no matter how tempting they make it.",Hermes,The Sea of Monsters,Rick Riordan,2006
Nothing like a reformed kleptomaniac for stealing back stolen stuff.,Percy Jackson,The Sea of Monsters,Rick Riordan,2006
Even the bravest can fall.,Athena,The Titan's Curse,Rick Riordan,2007
Getting something and having the wits to use it... those are two different things.,Athena,The Titan's Curse,Rick Riordan,2007
Knowing yourself is the beginning of all wisdom.,Athena,The Titan's Curse,Rick Riordan,2007
"Your fatal flaw is personal loyalty. To save a friend, you would sacrifice the world.",Athena,The Titan's Curse,Rick Riordan,2007
How did you die? - We er... drowned in a bathtub. - All three of you? - It was a big bathtub.,Percy Jackson and the Stoll brothers,The Titan's Curse,Rick Riordan,2007
Let us find the dam snack bar.,Zoë Nightshade,The Titan's Curse,Rick Riordan,2007
Be careful of love. It'll twist your brain around and leave you thinking up is down and right is wrong.,Hephaestus,The Battle of the Labyrinth,Rick Riordan,2008
It isn't easy being a brilliant inventor. Always alone. Always misunderstood.,Hephaestus,The Battle of the Labyrinth,Rick Riordan,2008
"People are more difficult to work with than machines. And when you break a person, he can't be fixed.",Hephaestus,The Battle of the Labyrinth,Rick Riordan,2008
"Nothing like watching your relatives fight, I always say.",Hermes,The Battle of the Labyrinth,Rick Riordan,2008
You are okay? Not eaten by monsters?,Tyson,The Battle of the Labyrinth,Rick Riordan,2008
All I care about is keeping you safe. Don't you understand?,Annabeth Chase,The Last Olympian,Rick Riordan,2009
"I am never, ever going to make things easy for you, Seaweed Brain. Get used to it.",Annabeth Chase,The Last Olympian,Rick Riordan,2009
You hit the Lord of the Titans in the eye with a blue plastic hairbrush.,Annabeth Chase,The Last Olympian,Rick Riordan,2009
Sometimes the hardest power to master is the power of yielding.,Hestia,The Last Olympian,Rick Riordan,2009
"Even in death, my monsters do not rest. They will remember you, Percy Jackson.",Kronos,The Last Olympian,Rick Riordan,2009
With great power... comes great need to take a nap. Wake me up later.,Nico di Angelo,The Last Olympian,Rick Riordan,2009
You promised you would protect her. You promised.,Nico di Angelo,The Last Olympian,Rick Riordan,2009
Because Hope survives best at the hearth. Guard it for me and I won't be tempted to give up again.,Percy Jackson,The Last Olympian,Rick Riordan,2009
Can't you nudge them to fight a little nicer?,Percy Jackson,The Last Olympian,Rick Riordan,2009
Deadlines just aren't real to me until I'm staring one in the face.,Percy Jackson,The Last Olympian,Rick Riordan,2009
It's hard to enjoy practical jokes when your whole life feels like one.,Percy Jackson,The Last Olympian,Rick Riordan,2009
"The world was collapsing, and the only thing that really mattered to me was that she was alive.",Percy Jackson,The Last Olympian,Rick Riordan,2009
Even heroes have the right to be sad.,Poseidon,The Last Olympian,Rick Riordan,2009
The most dangerous flaws are those which are good in moderation.,Rachel Dare,The Last Olympian,Rick Riordan,2009
You must forge your own path for it to mean anything.,Hera,The Lost Hero,Rick Riordan,2010
Fairness does not mean everyone gets the same. Fairness means everyone gets what they need.,Leo Valdez,The Lost Hero,Rick Riordan,2010
"I figure the universe is basically like a machine. I don't know who made it, but it chugs along okay as long as you keep it well oiled.",Leo Valdez,The Lost Hero,Rick Riordan,2010
"Wow, when he invents a lie, he does it with style.",Leo Valdez,The Lost Hero,Rick Riordan,2010
Being a hero doesn't mean you're invincible. It just means that you're brave enough to stand up and do what's needed.,Piper McLean,The Lost Hero,Rick Riordan,2010
"Heroes are never perfect. But they're brave, they're authentic, they're courageous, determined, discreet, and they've got grit.",Piper McLean,The Lost Hero,Rick Riordan,2010
I try not to think. It interferes with being nuts.,Leo Valdez,The Mark of Athena,Rick Riordan,2012
We're staying together. You're not getting away from me. Never again.,Percy Jackson,The Mark of Athena,Rick Riordan,2012
Chocolate is good. Everything else is questionable.,Coach Hedge,The House of Hades,Rick Riordan,2013
"Love is on every side, and no one's side. Don't ask what Love can do for you.",Cupid,The House of Hades,Rick Riordan,2013
"Life is only precious because it ends, kid.",Leo Valdez,The Blood of Olympus,Rick Riordan,2014
Nothing is unfixable.,Leo Valdez,The Blood of Olympus,Rick Riordan,2014
I've heard tell that what you imagine sometimes comes true.,Grandpa Joe,Charlie and the Chocolate Factory,Roald Dahl,1964
Don't forget what happened to the man who suddenly got everything he wanted. He lived happily ever after.,Willy Wonka,Charlie and the Chocolate Factory,Roald Dahl,1964
"However small the chance might be of striking lucky, the chance is there.",,Charlie and the Chocolate Factory,Roald Dahl,1964
"So please, oh please, we beg, we pray, go throw your TV set away and install a lovely bookshelf on the wall filled with lots of books.",,Charlie and the Chocolate Factory,Roald Dahl,1964
So shines a good deed in a weary world.,,Charlie and the Chocolate Factory,Roald Dahl,1964
"There is something about very cold weather that gives one an enormous appetite. Because we are luckier than we realize, we usually get what we want—or near enough.",,Charlie and the Chocolate Factory,Roald Dahl,1964
"We are all a great deal luckier that we realize, we usually get what we want - or near enough.",,Charlie and the Chocolate Factory,Roald Dahl,1964
"You should never, never doubt something that no one is sure of.",,Charlie and the Chocolate Factory,Roald Dahl,1964
"It doesn’t matter who you are or what you look like, so long as somebody loves you.",,The Witches,Roald Dahl,1983
That child of Hell had nothing human; nothing lived in him but fear and hatred.,Dr. Jekyll,The Strange Case of Dr. Jekyll and Mr. Hyde,Robert Louis Stevenson,1886
"When you can’t find someone to follow, you have to find a way to lead by example.",,Bad Feminist,Roxane Gay,2014
"Stay gold, Ponyboy, stay gold.",,The Outsiders,S. E. Hinton,1967
Life offers up these moments of joy despite everything.,,Normal People,Sally Rooney,2018
We accept the love we think we deserve.,,The Perks of Being a Wallflower,Stephen Chbosky,1999
But see that you get on. That's your job in this hard world.,Jack Torrance,The Shining,Stephen King,1977
"That's your job in this hard world, to keep your love alive and see that you get on, no matter what.",Jack Torrance,The Shining,Stephen King,1977
"The world don’t love you, but your momma does and so do I.",Jack Torrance,The Shining,Stephen King,1977
"The world's a hard place, Danny. It don't care.",Jack Torrance,The Shining,Stephen King,1977
Children have to grow into their imaginations like a pair of oversized shoes.,,The Shining,Stephen King,1977
"I think all mothers shine a little, you know, at least until their kids grow up enough to watch out for themselves.",,The Shining,Stephen King,1977
Monsters are real. Ghosts are too.,,The Shining,Stephen King,1977
She had never dreamed there could be so much pain in a life when there was nothing physically wrong. She hurt all the time.,,The Shining,Stephen King,1977
"Sometimes human places, create inhuman monsters.",,The Shining,Stephen King,1977
The sleep of reason breeds monsters.,,The Shining,Stephen King,1977
The tears that heal are also the tears that scald and scourge.,,The Shining,Stephen King,1977
We sometimes need to create unreal monsters and bogies to stand in for all the things we fear in our real lives.,,The Shining,Stephen King,1977
"When we grow up, concepts gradually get easier and we leave the images to the poets",,The Shining,Stephen King,1977
The place where you made your stand never mattered. Only that you were there… and still on your feet.,,The Stand,Stephen King,1978
"Get busy living, or get busy dying.",,Different Seasons,Stephen King,1982
Get busy living or get busy dying.,,Rita Hayworth and Shawshank Redemption,Stephen King,1982
"Go then, there are other worlds than these.",Jake,The Gunslinger,Stephen King,1982
I do not aim with my hand; he who aims with his hand has forgotten the face of his father. I aim with my eye.,Roland,The Gunslinger,Stephen King,1982
I kill with my heart.,Roland,The Gunslinger,Stephen King,1982
"The man in black fled across the desert, and the gunslinger followed.",,The Gunslinger,Stephen King,1982
Time is a face on the water.,,The Gunslinger,Stephen King,1982
"Because sometimes, silence is best.",Roland,Wizard and Glass,Stephen King,1997
"If you love me, then love me.",Susan Delgado,Wizard and Glass,Stephen King,1997
It seemed to him that the most horrible fact of human existence was that broken hearts mended.,,Wizard and Glass,Stephen King,1997
"First comes smiles, then lies. Last is gunfire.",Roland,Wolves of the Calla,Stephen King,2003
It was the possibility of darkness that made the day seem so bright.,Susannah,Wolves of the Calla,Stephen King,2003
"Even if the torture stops, I'll die. And you'll die too, for when love leaves the world, all hearts are still.",The Beam,The Dark Tower,Stephen King,2004
"A person's never too old for stories. Man and boy, girl and woman, never too old. We live for them.",Roland Deschain,The Wind Through the Keyhole,Stephen King,2012
"In the end, the wind takes everything, doesn't it? And why not? If the sweetness of our lives did not depart, there would be no sweetness at all.",,The Wind Through the Keyhole,Stephen King,2012
"Pray for rain all you like, but dig a well as you do it.",,The Wind Through the Keyhole,Stephen King,2012
It's been almost a century that Edward's been alone. Now he's found you. Do you think any of us want to look into his eyes for the next hundred years if he loses you?,Alice Cullen,Twilight,Stephenie Meyer,2005
"About three things I was absolutely positive. First, Edward was a vampire. Second, there was part of him that thirsted for my blood.",Bella Swan,Twilight,Stephenie Meyer,2005
"I'd never given much thought to how I would die  though I'd had reason enough in the last few months  but even if I had, I would not have imagined it like this.",Bella Swan,Twilight,Stephenie Meyer,2005
"It was beautiful, of course; I couldn't deny that. Everything was green: the trees, their trunks covered with moss, their branches hanging with a canopy of it.",Bella Swan,Twilight,Stephenie Meyer,2005
"When he touched me, it stung my hand as if an electric current had passed through us.",Bella Swan,Twilight,Stephenie Meyer,2005
"When life offers you a dream so far beyond any of your expectations, it's not reasonable to grieve when it comes to an end.",Bella Swan,Twilight,Stephenie Meyer,2005
"I love you, you are my life now.",Bella Swan and Edward Cullen,Twilight,Stephenie Meyer,2005
"For almost ninety years I've walked among my kind and yours, thinking I was complete in myself, not realizing what I was seeking.",Edward Cullen,Twilight,Stephenie Meyer,2005
"I decided as long as I was going to hell, I might as well do it thoroughly.",Edward Cullen,Twilight,Stephenie Meyer,2005
"It's twilight. Darkness is so predictable, don't you think?",Edward Cullen,Twilight,Stephenie Meyer,2005
Trust me just this once  you are the opposite of ordinary.,Edward Cullen,Twilight,Stephenie Meyer,2005
"Twilight, again. Another ending. No matter how perfect the day is, it always has to end.",Edward Cullen,Twilight,Stephenie Meyer,2005
What if I'm not a superhero? What if I'm the bad guy?,Edward Cullen,Twilight,Stephenie Meyer,2005
You are exactly my brand of heroin.,Edward Cullen,Twilight,Stephenie Meyer,2005
"I like the night. Without the dark, we'd never see the stars.",Edward Cullen and Bella Swan,Twilight,Stephenie Meyer,2005
No one will dare to call you plain when I'm through with you.,Alice Cullen,Breaking Dawn,Stephenie Meyer,2008
And then Edward and I continued blissfully into this small but perfect piece of our forever.,Bella Cullen,Breaking Dawn,Stephenie Meyer,2008
Don't be afraid. We belong together.,Bella Cullen,Breaking Dawn,Stephenie Meyer,2008
He smiled the kind of smile that would have stopped my heart if it were still beating.,Bella Cullen,Breaking Dawn,Stephenie Meyer,2008
How did people do this — swallow all their fears and trust someone else so implicitly with every imperfection and fear they had — with less than the absolute commitment Edward had given me?,Bella Cullen,Breaking Dawn,Stephenie Meyer,2008
I lifted my head and kissed Edward with a passion that might possibly set the forest on fire. I wouldn't have noticed.,Bella Cullen,Breaking Dawn,Stephenie Meyer,2008
"I told you— Did you know that 'I told you so' has a brother, Jacob? His name is 'Shut the hell up.'",Bella Cullen,Breaking Dawn,Stephenie Meyer,2008
"It was like I had been born to be a vampire. The idea made me want to laugh, but it also made me want to sing. I had found my true place in the world, the place I fit, the place I shined.",Bella Cullen,Breaking Dawn,Stephenie Meyer,2008
"The brilliant light overhead was still blinding-bright, and yet I could plainly see the glowing strands of the filaments inside the bulb. I could see each color of the rainbow in the white light, and, at the very edge of the spectrum, an eighth color I had no name for.",Bella Cullen,Breaking Dawn,Stephenie Meyer,2008
Do you want me to sing to you? I'll sing all night if it will keep the bad dreams away.,Edward Cullen,Breaking Dawn,Stephenie Meyer,2008
"Goodbye, Jacob, my brother...my son.",Edward Cullen,Breaking Dawn,Stephenie Meyer,2008
I came to witness. I stay to fight. The Volturi care nothing for the death of a child. They seek the death of our free will.,Garrett,Breaking Dawn,Stephenie Meyer,2008
"If we live through this, I'll follow you anywhere, woman.",Garrett,Breaking Dawn,Stephenie Meyer,2008
"Who rules you, nomads? Do you answer to someone's will besides your own? Are you free to choose your own path, or will the Volturi decide how you will live?",Garrett,Breaking Dawn,Stephenie Meyer,2008
"Carlisle Cullen. Looking at him without that hate clouding my eyes, I couldn't deny that killing him was murder. He was good. Good as any human we protected. Maybe better. Too much better.",Jacob Black,Breaking Dawn,Stephenie Meyer,2008
"I could see that now — how the universe swirled around this one point. I'd never seen the symmetry of the universe before, but now it was plain. The gravity of the earth no longer tied me to the place where I stood.",Jacob Black,Breaking Dawn,Stephenie Meyer,2008
"Life sucks, and then you die. Yeah, I should be so lucky.",Jacob Black,Breaking Dawn,Stephenie Meyer,2008
This was the problem with hanging out with vampires — you got used to them. They started messing up the way you saw the world. They started feeling like friends.,Jacob Black,Breaking Dawn,Stephenie Meyer,2008
"Bella's sacrifice is a heavy price, and we will all recognize that. It is against everything we stand for to take a human life. Making an exception to that code is a bleak thing. We will all mourn for what we do tonight.",Sam Uley,Breaking Dawn,Stephenie Meyer,2008
"If your life was all you had to give your beloved, how could you not give it?",,Breaking Dawn,Stephenie Meyer,2008
"When you loved the one who was killing you, it left you no options. How could you run, how could you fight, when doing so would hurt that beloved one?",,Breaking Dawn,Stephenie Meyer,2008
Being related is no guarantee of love!,,The Girl with the Dragon Tattoo,Stieg Larsson,2005
Everyone has secrets. It's just a matter of finding out what they are.,,The Girl with the Dragon Tattoo,Stieg Larsson,2005
Friendship is built on two things: respect and trust. Both elements have to be there and must be mutual.,,The Girl with the Dragon Tattoo,Stieg Larsson,2005
Her absence had felt like torture--almost a form of personal punishment.,,The Girl with the Dragon Tattoo,Stieg Larsson,2005
"Impulsive actions led to trouble, and trouble could have unpleasant consequences.",,The Girl with the Dragon Tattoo,Stieg Larsson,2005
Isn't it fascinating that Nazis always manage to adopt the word freedom?,,The Girl with the Dragon Tattoo,Stieg Larsson,2005
"It doesn't matter how good the enemy's weapons are. If he can't see you, he can't hit you.",,The Girl with the Dragon Tattoo,Stieg Larsson,2005
"No, I don't believe in God, but I respect the fact that you do. Everyone has to have something to believe in.",,The Girl with the Dragon Tattoo,Stieg Larsson,2005
Sometimes they were together so often that it felt as though they really were a couple.,,The Girl with the Dragon Tattoo,Stieg Larsson,2005
What she had realized was that love was that moment when your heart was about to burst.,,The Girl with the Dragon Tattoo,Stieg Larsson,2005
"Appear weak when you are strong, and strong when you are weak.",,The Art of War,Sun Tzu,-500
Happy Hunger Games! And may the odds be ever in your favor.,Effie,Hunger Games,Suzanne Collins,2008
"For there to be betrayal, there would have to have been trust first.",Peeta,Hunger Games,Suzanne Collins,2008
And may the odds be ever in your favor.,,The Hunger Games,Suzanne Collins,2008
"Katniss, there is no District Twelve.",Gale,Catching Fire,Suzanne Collins,2009
Aim higher in case you fall short.,Katniss,Catching Fire,Suzanne Collins,2009
"At some point, you have to stop running and turn around and face whoever wants you dead. The hard thing is finding the courage to do it.",Katniss,Catching Fire,Suzanne Collins,2009
Gale is mine. I am his. Anything else is unthinkable.,Katniss,Catching Fire,Suzanne Collins,2009
