quotetext,character,title,author,year
Maybe 'okay' will be our 'always.,,'The Fault in Our Stars','John Green',2012
I wonder what Piglet is doing. I wish I were there to be doing it too.,Pooh,Winnie-the-Pooh,A.A. Milne,1926
Be sure thy sin will find thee out.,,And Then There Were None,Agatha Christie,1939
Best of an island is once you get there - you can't go any farther...you've come to the end of things...,,And Then There Were None,Agatha Christie,1939
"But no artist, I now realize, can be satisfied with art alone. There is a natural craving for recognition which cannot be gain-said.",,And Then There Were None,Agatha Christie,1939
"Crime is terribly revealing. Try and vary your methods as you will, your tastes, your habits, your attitude of mind, and your soul is revealed by your actions.",,And Then There Were None,Agatha Christie,1939
"Fear, what a strange thing fear was...",,And Then There Were None,Agatha Christie,1939
"One little Indian left all alone, he went out and hanged himself and then there were none.",,And Then There Were None,Agatha Christie,1939
One of us in this very room is in fact the murderer.,,And Then There Were None,Agatha Christie,1939
There was something magical about an island—the mere word suggested fantasy. You lost touch with the world—an island was a world of its own.,,And Then There Were None,Agatha Christie,1939
This is no time for refusing to look facts in the face.,,And Then There Were None,Agatha Christie,1939
"Ulick Norman Owen—Una Nancy Owen—each time, that is to say, U. N. Owen. Or by a slight stretch of fancy, UNKNOWN!",,And Then There Were None,Agatha Christie,1939
"When a man's neck's in danger, he doesn't stop to think too much about sentiment.",,And Then There Were None,Agatha Christie,1939
"When the sea goes down, there will come from the mainland boats and men. And they will find ten dead bodies and an unsolved problem on Indian Island.",,And Then There Were None,Agatha Christie,1939
You're very young...you haven't got to that yet. But it does come! The blessed relief when you know that you've done with it all.,,And Then There Were None,Agatha Christie,1939
"Anarchy means 'without leaders', not 'without order'.",V,V for Vendetta,Alan Moore,1982
"Everybody is special. Everybody. Everybody is a hero, a lover, a fool, a villain, everybody. Everybody has their story to tell…",V,V for Vendetta,Alan Moore,1982
"Happiness is a prison, Evey. Happiness is the most insidious prison of all.",V,V for Vendetta,Alan Moore,1982
"I'll admit that anyone can make a mistake once, to go on making the same lethal errors century after century seems to me nothing short of deliberate.",V,V for Vendetta,Alan Moore,1982
Justice is meaningless without Freedom.,V,V for Vendetta,Alan Moore,1982
There's no flesh or blood within this cloak to kill. There's only an idea. Ideas are bulletproof.,V,V for Vendetta,Alan Moore,1982
"Remember, remember the fifth of November, the gunpowder treason and plot. I know of no reason why the gunpowder treason should ever be forgot.",,V for Vendetta,Alan Moore,1982
Humanity's savage nature will inevitably lead to global annihilation.,Adrian Veidt/Ozymandias,Watchmen,Alan Moore,1987
"I did the right thing, didn't I? It all worked out in the end.",Adrian Veidt/Ozymandias,Watchmen,Alan Moore,1987
I don't mind being the smartest man in the world. I just wish it wasn't this one.,Adrian Veidt/Ozymandias,Watchmen,Alan Moore,1987
"My intellect set me apart. Faced with difficult choices, I knew nobody whose advice might prove useful. Nobody living.",Adrian Veidt/Ozymandias,Watchmen,Alan Moore,1987
"The ancient world's greatest puzzle was there, a knot that couldn't be untied. Alexander cut it in two with his sword.",Adrian Veidt/Ozymandias,Watchmen,Alan Moore,1987
To save billions. A necessary crime.,Adrian Veidt/Ozymandias,Watchmen,Alan Moore,1987
"Y'know, this must be how ordinary people feel around us.",Daniel Dreiberg/Nite Owl II,Watchmen,Alan Moore,1987
A live body and a dead body contain the same number of particles. Life and death are unquantifiable abstracts.,Doctor Manhattan,Watchmen,Alan Moore,1987
Everything is preordained. Even my responses.,Doctor Manhattan,Watchmen,Alan Moore,1987
"Nothing ends, Adrian. Nothing ever ends.",Doctor Manhattan,Watchmen,Alan Moore,1987
There is no future. There is no past. Time is simultaneous.,Doctor Manhattan,Watchmen,Alan Moore,1987
"We gaze continually at the world and it grows dull in our perceptions. Yet seen from another's vantage point, it may still take our breath away.",Doctor Manhattan,Watchmen,Alan Moore,1987
"We're all puppets, Laurie. I'm just a puppet who can see the strings.",Doctor Manhattan,Watchmen,Alan Moore,1987
"In my opinion, the existence of life is a highly overrated phenomenon.",Rorschach,Watchmen,Alan Moore,1987
None of you understand. I'm not locked up in here with you. You're locked up in here with me.,Rorschach,Watchmen,Alan Moore,1987
"Why does one death matter against so many? Because there is good and there is evil, and evil must be punished.",Rorschach,Watchmen,Alan Moore,1987
"Justice is coming to all of us, no matter what we do.",The Comedian,Watchmen,Alan Moore,1987
"Once you realize what a joke everything is, being the Comedian is the only thing that makes sense.",The Comedian,Watchmen,Alan Moore,1987
It doesn't take a genius to see that this world has problems.,,Watchmen,Alan Moore,1987
Who watches the Watchmen?,,Watchmen,Alan Moore,1987
And it was like knocking four quick times on the door of unhappiness.,Meursault,The Outsider,Albert Camus,1942
I explained to him that my nature was such that my physical needs often got in the way of my feelings.,Meursault,The Outsider,Albert Camus,1942
I felt that I had been happy and that I was happy again.,Meursault,The Outsider,Albert Camus,1942
"I felt the urge to reassure him that I was like everybody else, just like everybody else.",Meursault,The Outsider,Albert Camus,1942
"I knew that I had shattered the harmony of the day, the exceptional silence of a beach where I'd been happy.",Meursault,The Outsider,Albert Camus,1942
"I often thought that if I had to live in the trunk of a dead tree, with nothing to do but look up at the sky flowing overhead, I would have gotten used to it.",Meursault,The Outsider,Albert Camus,1942
I realized then that a man who had lived only one day could easily live for a hundred years in prison. He would have enough memories to keep him from being bored.,Meursault,The Outsider,Albert Camus,1942
"It was as if that great rush of anger had washed me clean, emptied me of hope, and, gazing up at the dark sky spangled with its signs and stars, I laid my heart open to the benign indifference of the universe.",Meursault,The Outsider,Albert Camus,1942
"Maman used to say that you can always find something to be happy about. In prison, when the sky turned red and a new day slipped into my cell, I found out that she was right.",Meursault,The Outsider,Albert Camus,1942
"Mother used to say that however miserable one is, there's always something to be thankful for. And each morning, when the sky brightened and light began to flood my cell, I agreed with her.",Meursault,The Outsider,Albert Camus,1942
One always has exaggerated ideas about what one doesn't know.,Meursault,The Outsider,Albert Camus,1942
After awhile you could get used to anything.,,The Stranger,Albert Camus,1942
I had only a little time left and I didn't want to waste it on God.,,The Stranger,Albert Camus,1942
I looked up at the mass of signs and stars in the night sky and laid myself open for the first time to the benign indifference of the world.,,The Stranger,Albert Camus,1942
"I may not have been sure about what really did interest me, but I was absolutely sure about what didn't.",,The Stranger,Albert Camus,1942
I opened myself to the gentle indifference of the world.,,The Stranger,Albert Camus,1942
"If something is going to happen to me, I want to be there.",,The Stranger,Albert Camus,1942
It is better to burn than to disappear.,,The Stranger,Albert Camus,1942
"Maman used to say that you can always find something to be happy about. In my prison, when the sky turned red and a new day slipped into my cell, I found out that she was right.",,The Stranger,Albert Camus,1942
Mother died today. Or maybe yesterday; I can't be sure.,,The Stranger,Albert Camus,1942
"Since we're all going to die, it's obvious that when and how don't matter.",,The Stranger,Albert Camus,1942
There is not love of life without despair about life.,,The Stranger,Albert Camus,1942
"Don't you wish you were free, Lenina?",Bernard Marx,Brave New World,Aldous Huxley,1932
"I'd rather be myself. Myself and nasty. Not somebody else, however jolly.",Bernard Marx,Brave New World,Aldous Huxley,1932
"Words can be like X-rays, if you use them properly - they'll go through anything. You read and you're pierced.",Helmholtz Watson,Brave New World,Aldous Huxley,1932
"Actual happiness always looks pretty squalid in comparison with the over-compensations for misery. And, of course, stability isn't nearly so spectacular as instability.",Mustapha Mond,Brave New World,Aldous Huxley,1932
We are not our own any more than what we possess is our own.,Mustapha Mond,Brave New World,Aldous Huxley,1932
We prefer to do things comfortably.,Mustapha Mond,Brave New World,Aldous Huxley,1932
Happiness has got to be paid for.,The Controller,Brave New World,Aldous Huxley,1932
Happiness is a hard master – particularly other people's happiness.,The Controller,Brave New World,Aldous Huxley,1932
Suffer little children.,The Controller,Brave New World,Aldous Huxley,1932
A gramme is better than a damn.,,Brave New World,Aldous Huxley,1932
All the advantages of Christianity and alcohol; none of their defects.,,Brave New World,Aldous Huxley,1932
Cleanliness is next to fordliness.,,Brave New World,Aldous Huxley,1932
Every one belongs to every one else.,,Brave New World,Aldous Huxley,1932
Never put off till to-morrow the fun you can have to-day.,,Brave New World,Aldous Huxley,1932
O brave new world that has such people in it. Let's start at once.,,Brave New World,Aldous Huxley,1932
"O brave new world, O brave new world …",,Brave New World,Aldous Huxley,1932
One cubic centimetre cures ten gloomy sentiments.,,Brave New World,Aldous Huxley,1932
One gramme is better than a damn.,,Brave New World,Aldous Huxley,1932
Most men and women will grow up to love their servitude and will never dream of revolution.,,Brave New World Revisited,Aldous Huxley,1958
"Unexpressed emotions will never die. They are buried alive, and will come forth later, in uglier ways.",,The Silent Patient,Alex Michaelides,2019
To learn is not to know; there are the learners and the learned. Memory makes the one philosophy the other.,Abbe Faria,The Count of Monte Cristo,Alexandre Dumas,1844
What a fool I was not to tear my heart out on the day when I resolved to avenge myself!,Edmond,The Count of Monte Cristo,Alexandre Dumas,1844
I have substituted myself for Providence in rewarding the good; may the God of vengeance now yield me His place to punish the wicked.,Edmond Dantes,The Count of Monte Cristo,Alexandre Dumas,1844
Life is a storm my young friend. You will bask in the sunlight one moment frolic in the leaves of the forest the next and before you know it you will be struggling in the darkness.,Edmond Dantes,The Count of Monte Cristo,Alexandre Dumas,1844
We are never quits with those who oblige us for when we do not owe them money we owe them gratitude.,Edmond Dantes,The Count of Monte Cristo,Alexandre Dumas,1844
All human wisdom is contained in these two words: Wait and hope!,,The Count of Monte Cristo,Alexandre Dumas,1844
All human wisdom is summed up in these two words – ‘Wait and hope.’,,The Count of Monte Cristo,Alexandre Dumas,1844
Human nature in a right and wholesome state revolts at crime.,,The Count of Monte Cristo,Alexandre Dumas,1844
Private misfortunes must never induce us to neglect public affairs.,,The Count of Monte Cristo,Alexandre Dumas,1844
There is neither happiness nor misery in the world; there is only the comparison of one state with another nothing more.,,The Count of Monte Cristo,Alexandre Dumas,1844
We must have felt what it is to die that we may appreciate the enjoyments of life.,,The Count of Monte Cristo,Alexandre Dumas,1844
"Life is a chaplet of little miseries which the philosopher counts with a smile. Be philosophers, sit down at the table and let us drink",Athos,The Three Musketeers,Alexandre Dumas,1844
"Weep, heart full of love, youth, and life! Alas, would I could weep like you",Athos,The Three Musketeers,Alexandre Dumas,1844
"All for one, one for all, that is our motto",,The Three Musketeers,Alexandre Dumas,1844
"You are young, and your bitter recollections have time to change themselves into sweet remembrances",,The Three Musketeers,Alexandre Dumas,1844
"Made weak by time and fate, but strong in will To strive, to seek, to find, and not to yield.",,Ulysses,Alfred Lord Tennyson,1859
Time moves slowly but passes quickly.,,The Color Purple,Alice Walker,1982
"Time moves slowly, but passes quickly.",,The Color Purple,Alice Walker,1982
"For there is always light, / If only we’re brave enough to see it. / If only we’re brave enough to be it.",,Call Us What We Carry,Amanda Gorman,2021
Then you must teach my daughter this same lesson. How to lose your innocence but not your hope. How to laugh forever.,,The Joy Luck Club,Amy Tan,1989
"How you live your life is your business. But remember, our hearts and our bodies are given to us only once. Most of us can’t help but live as though we’ve got two lives to live, one is the mockup, the other the finished version, and then there are all those versions in between.",,Call Me By Your Name,André Aciman,2007
"Most of us can’t help but live as though we’ve got two lives to live, one is the mockup, the other the finished version, and then there are all those versions in between.",,Call Me by Your Name,André Aciman,2007
It is better to be hated for what you are than to be loved for what you are not.,,Autumn Leaves,André Gide,1956
Brave doesn’t mean you’re not scared. It means you go on even though you’re scared.,,The Hate U Give,Angie Thomas,2017
What’s the point of having a voice if you’re gonna be silent in those moments you shouldn’t be?,,The Hate U Give,Angie Thomas,2017
The love between humans is the thing that nails us to this earth.,,This Is the Story of a Happy Marriage,Ann Patchett,2013
"We had made a fetish out of our misfortune, fallen in love with it.",,The Dutch House,Ann Patchett,2019
A quiet conscience makes one strong!,Anne Frank,The Diary of a Young Girl,Anne Frank,1947
"Although I'm only fourteen, I know quite well what I want, I know who is right and who is wrong. I have my opinions, my own ideas and principles, and although it may sound pretty mad from an adolescent, I feel more of a person than a child, I feel quite independent of anyone.",Anne Frank,The Diary of a Young Girl,Anne Frank,1947
"Anyhow, I've learned one thing now. You only really get to know people when you've had a jolly good row with them.",Anne Frank,The Diary of a Young Girl,Anne Frank,1947
"As long as this exists, this sunshine and this cloudless sky, and as long as I can enjoy it, how can I be sad?",Anne Frank,The Diary of a Young Girl,Anne Frank,1947
"But feelings can't be ignored, no matter how unjust or ungrateful they seem.",Anne Frank,The Diary of a Young Girl,Anne Frank,1947
"Deep down, the young are lonelier than the old.",Anne Frank,The Diary of a Young Girl,Anne Frank,1947
"Everyone thinks I'm showing off when I talk, ridiculous when I'm silent, insolent when I answer, cunning when I have a good idea, lazy when I'm tired, selfish when I eat one bite more than I should.",Anne Frank,The Diary of a Young Girl,Anne Frank,1947
"I don't think of all the misery, but of the beauty that still remains.",Anne Frank,The Diary of a Young Girl,Anne Frank,1947
"I have one outstanding trait in my character, which must strike anyone who knows me for any length of time, and that is my knowledge of myself. I can watch myself and my actions, just like an outsider.",Anne Frank,The Diary of a Young Girl,Anne Frank,1947
"I know what I want, I have a goal, an opinion, I have a religion and love. Let me be myself and then I am satisfied.",Anne Frank,The Diary of a Young Girl,Anne Frank,1947
"I love you, with a love so great that it simply couldn't keep growing inside my heart, but had to leap out and reveal itself in all its magnitude.",Anne Frank,The Diary of a Young Girl,Anne Frank,1947
"I think a lot, but I don't say much.",Anne Frank,The Diary of a Young Girl,Anne Frank,1947
I wish to go on living even after my death.,Anne Frank,The Diary of a Young Girl,Anne Frank,1947
"I've found that there is always some beauty left -- in nature, sunshine, freedom, in yourself; these can all help you.",Anne Frank,The Diary of a Young Girl,Anne Frank,1947
"In spite of everything I still believe that people are really good at heart. I simply can’t build up my hopes on a foundation consisting of confusion, misery, and death.",Anne Frank,The Diary of a Young Girl,Anne Frank,1947
"In the long run, the sharpest weapon of all is a kind and gentle spirit.",Anne Frank,The Diary of a Young Girl,Anne Frank,1947
"It's really a wonder that I haven't dropped all my ideals, because they seem so absurd and impossible to carry out. Yet I keep them, because in spite of everything, I still believe that people are really good at heart.",Anne Frank,The Diary of a Young Girl,Anne Frank,1947
"People can tell you to keep your mouth shut, but that doesn't stop you from having your own opinion.",Anne Frank,The Diary of a Young Girl,Anne Frank,1947
"People who have a religion should be glad, for not everyone has the gift of believing in heavenly things. You don't necessarily even have to be afraid of punishment after death; purgatory, hell, and heaven are things that a lot of people can't accept, but still a religion, it doesn't matter which, keeps a person on the right path.",Anne Frank,The Diary of a Young Girl,Anne Frank,1947
"Sometimes I believe that God wants to try me, both now and later on; I must become good through my own efforts, without examples and without good advice.",Anne Frank,The Diary of a Young Girl,Anne Frank,1947
"Sympathy, Love, Fortune... We all have these qualities but still tend to not use them!",Anne Frank,The Diary of a Young Girl,Anne Frank,1947
"The best remedy for those who are afraid, lonely or unhappy is to go outside, somewhere where they can be quite alone with the heavens, nature and God. Because only then does one feel that all is as it should be and that God wishes to see people happy, amidst the simple beauty of nature.",Anne Frank,The Diary of a Young Girl,Anne Frank,1947
"The weak die out and the strong will survive, and will live on forever",Anne Frank,The Diary of a Young Girl,Anne Frank,1947
"The weak fall, but the strong will remain and never go under!",Anne Frank,The Diary of a Young Girl,Anne Frank,1947
"There's only one rule you need to remember: laugh at everything and forget everybody else! It sounds egotistical, but it's actually the only cure for those suffering from self-pity.",Anne Frank,The Diary of a Young Girl,Anne Frank,1947
"Where there's hope, there's life. It fills us with fresh courage and makes us strong again.",Anne Frank,The Diary of a Young Girl,Anne Frank,1947
Whoever is happy will make others happy.,Anne Frank,The Diary of a Young Girl,Anne Frank,1947
"Women should be respected as well! Generally speaking, men are held in great esteem in all parts of the world, so why shouldn't women have their share?",Anne Frank,The Diary of a Young Girl,Anne Frank,1947
"You can be lonely even when you are loved by many people, since you are still not anybody's one and only.",Anne Frank,The Diary of a Young Girl,Anne Frank,1947
None of us really changes over time. We only become more fully what we are.,,The Vampire Lestat,Anne Rice,1985
Am I just to be like a clockwork orange?,Alex,A Clockwork Orange,Anthony Burgess,1962
"It was like a bird of rarest-spun heaven metal or like silvery wine flowing in a spaceship, gravity all nonsense now.",Alex,A Clockwork Orange,Anthony Burgess,1962
It’s funny how the colours of the real world only seem really real when you viddy them on the screen.,Alex,A Clockwork Orange,Anthony Burgess,1962
"Oh bliss, bliss and heaven... Oh, it was gorgeousness and gorgeousity made flesh...",Alex,A Clockwork Orange,Anthony Burgess,1962
"Oh it was gorgeousness and gorgeosity made flesh. The trombones crunched redgold under my bed, and behind my gulliver the trumpets three-wise silverflamed.",Alex,A Clockwork Orange,Anthony Burgess,1962
Does God want goodness or the choice of goodness? Is a man who chooses to be bad perhaps in some way better than a man who has the good imposed upon him?,,A Clockwork Orange,Anthony Burgess,1962
"I see what is right and approve, but I do what is wrong.",,A Clockwork Orange,Anthony Burgess,1962
"If he can only perform good or only perform evil, then he is a clockwork orange—meaning that he has the appearance of an organism lovely with colour and juice but is in fact only a clockwork toy to be wound up by God or the Devil.",,A Clockwork Orange,Anthony Burgess,1962
Is it better for a man to have chosen evil than to have good imposed upon him?,,A Clockwork Orange,Anthony Burgess,1962
It is as inhuman to be totally good as it is to be totally evil.,,A Clockwork Orange,Anthony Burgess,1962
It's funny how the colors of the real world only seem really real when you watch them on a screen.,,A Clockwork Orange,Anthony Burgess,1962
"The important thing is moral choice. Evil has to exist along with good, in order that moral choice may operate.",,A Clockwork Orange,Anthony Burgess,1962
"We can destroy what we have written, but we cannot unwrite it.",,A Clockwork Orange,Anthony Burgess,1962
"When a man cannot choose, he ceases to be a man.",,A Clockwork Orange,Anthony Burgess,1962
Open your eyes and see what you can with them before they close forever.,,All the Light We Cannot See,Anthony Doerr,2014
"And now here is my secret, a very simple secret: It is only with the heart that one can see rightly; what is essential is invisible to the eye.",Fox,The Little Prince,Antoine de Saint-Exupry,1943
All grown-ups were once children... but only few of them remember it.,Narrator,The Little Prince,Antoine de Saint-Exupry,1943
It is only with the heart that one can see rightly; what is essential is invisible to the eye.,,The Little Prince,Antoine de Saint-Exupéry,1943
"No, darling! To die it's easy... But you have to struggle for life!",Vladek,The Complete Maus,Art Spiegelman,1991
It is a capital mistake to theorize before you have all the evidence. It biases the judgment.,Sherlock Holmes,A Study in Scarlet,Arthur Conan Doyle,1887
"It was easier to know it than to explain why I know it. If you were asked to prove that two and two made four, you might find some difficulty, and yet you are quite sure of the fact.",Sherlock Holmes,A Study in Scarlet,Arthur Conan Doyle,1887
"Before turning to those moral and mental aspects of the matter which present the greatest difficulties, let the inquirer begin by mastering more elementary problems.",Sherlock Holmes,The Sign of the Four,Arthur Conan Doyle,1890
"I consider that a man's brain originally is like a little empty attic, and you have to stock it with such furniture as you choose. A fool takes in all the lumber of every sort that he comes across, so that the knowledge which might be useful to him gets crowded out, or at best is jumbled up with a lot of other things, so that he has a difficulty in laying his hands upon it. Now the skillful workman is very careful indeed as to what he takes into his brain-attic. He will have nothing but the tools which may help him in doing his work, but of these he has a large assortment, and all in the most perfect order. It is a mistake to think that this little room has elastic walls and can distend to any extent. Depend upon it, there comes a time when for any addition of knowledge, you forget something that you knew before. It is of the highest importance, therefore, not to have useless facts elbowing out the useful ones.",Sherlock Holmes,The Sign of the Four,Arthur Conan Doyle,1890
"Life is infinitely stranger than anything which the mind of man could invent. We would not dare to conceive the things which are really mere commonplaces of existence. If we could fly out of that window hand in hand, hover over this great city, gently remove the roofs, and peep in at the queer things which are going on, the strange coincidences, the plannings, the cross-purposes, the wonderful chains of events, working through generations, and leading to the most outre results, it would make all fiction with its conventionalities and foreseen conclusions most stale and unprofitable.",Sherlock Holmes,The Sign of the Four,Arthur Conan Doyle,1890
"Never trust to general impressions, my boy, but concentrate yourself upon details.",Sherlock Holmes,The Sign of the Four,Arthur Conan Doyle,1890
"When a fact appears to be opposed to a long train of deductions, it invariably proves to be capable of bearing some other interpretation.",Sherlock Holmes,The Sign of the Four,Arthur Conan Doyle,1890
One's ideas must be as broad as Nature if they are to interpret Nature.,Sherlock Holmes,The Adventures of Sherlock Holmes,Arthur Conan Doyle,1892
We must balance probabilities and choose the most likely. It is the scientific use of the imagination.,Sherlock Holmes,The Adventures of Sherlock Holmes,Arthur Conan Doyle,1892
Things must be done decently and in order.,Sherlock Holmes,The Adventure of the Empty House,Arthur Conan Doyle,1903
