quotetext,character,title,author,year
"To save billions. A necessary crime.","Adrian Veidt/Ozymandias","Watchmen","Alan Moore","1987"
"Nothing ends, Adrian. Nothing ever ends.","Doctor Manhattan","Watchmen","Alan Moore","1987"
"There's no flesh or blood within this cloak to kill. There's only an idea. Ideas are bulletproof.",V,"V for Vendetta",Alan Moore,1982
"I'll admit that anyone can make a mistake once, to go on making the same lethal errors century after century seems to me nothing short of deliberate.",V,"V for Vendetta",Alan Moore,1982
"Happiness is a prison, Evey. Happiness is the most insidious prison of all.",V,"V for Vendetta",Alan Moore,1982
"Justice is meaningless without Freedom.",V,"V for Vendetta",Alan Moore,1982
"Anarchy means 'without leaders', not 'without order'.",V,"V for Vendetta",Alan Moore,1982
"Everybody is special. Everybody. Everybody is a hero, a lover, a fool, a villain, everybody. Everybody has their story to tell…",V,"V for Vendetta",Alan Moore,1982
"Remember, remember the fifth of November, the gunpowder treason and plot. I know of no reason why the gunpowder treason should ever be forgot.",,"V for Vendetta",Alan Moore,1982
"We don't need a map because where we are going, there is no map",,"Ready Player One","Ernest Cline",2011
"Being human totally sucks most of the time.",,"Ready Player One","Ernest Cline",2011
"Videogames are the only thing that make life bearable.",,"Ready Player One","Ernest Cline",2011
"Dude, you have balls of solid adamantium, Respect.","Aech","Ready Player One","Ernest Cline",2011
"There is no difference between Time and any of the three dimensions of Space except that our consciousness moves along it.",,"The Time Machine","H. G. Wells",1895
"Strength is the outcome of need; security sets a premium on feebleness.",,"The Time Machine","H. G. Wells",1895
"Looking at these stars suddenly dwarfed my own troubles and all the gravities of terrestrial life. Their unfathomable distance and slow inevitable drift out of the unknown past into the unknown future.","",The Time Machine,"H. G. Wells",1895
"The future is still black and blank—is a vast ignorance, lit at a few casual places by the memory of his story. Even when mind and strength had gone, gratitude and a mutual tenderness still lived on in the heart of man.","",The Time Machine,"H. G. Wells",1895
"There are really four dimensions, three which we call the three planes of Space, and a fourth, Time. It is only another way of looking at Time.","","The Time Machine","H. G. Wells",1895
"Space has three dimensions, each at right angles to the others. Some philosophical people have wondered why three dimensions, and have tried to construct a Four Dimensional geometry.","","The Time Machine","H. G. Wells",1895
"I have been at work upon this geometry of Four Dimensions for some time. Some of my results are curious.","","The Time Machine","H. G. Wells",1895
"Are you so sure we can move freely in Space? Gravitation limits us there.","","The Time Machine","H. G. Wells",1895
"We are always getting away from the present moment. Our mental existences are passing along the Time Dimension from the cradle to the grave.","","The Time Machine","H. G. Wells",1895
"This little affair is only a model. It is my plan for a machine to travel through Time.","","The Time Machine","H. G. Wells",1895
"Destiny is not a path you blindly follow. There are still choices to be made, and sometimes the heart speaks loudest.",Leafpool,Sign of the Moon,Erin Hunter,2003
"Listen to your heart, because that's where your true destiny lies.",Leafpool,Sign of the Moon,Erin Hunter,2003
"Even though she had just nearly been killed by two ShadowClan Warriors, she felt as if her paws were walking on the wind, and her head was filled with stars.",,,,
"Destiny isn't a path that any cat follows blindly. It is always a matter of choice, and sometimes the heart speaks loudest. Deep down, I always knew what I had to do, and that's why I came back to the Clan.",Leafpool,Sign of the Moon,Erin Hunter,2003
"We all make mistakes. Some have echoes that last forever.",Littlecloud,Fading Echoes,Erin Hunter,2006
"You must burn as brightly as this fire to protect your Clan. Survival is more important than the code of the medicine cats.",Raggedstar,Night Whispers,Erin Hunter,2009
"Listen to your heart, because that's where your true destiny lies.",Leafpool,Sign of the Moon,Erin Hunter,2003
"Even though she had just nearly been killed by two ShadowClan Warriors, she felt as if her paws were walking on the wind, and her head was filled with stars.",,,,
"Blackstar, welcome to our camp!",Blackstar,,, 
"Mistake them, and allow the past to haunt you forever. Trust in your heart and the path it shows you.",Leafpool,Sign of the Moon,Erin Hunter,2003
"But then... it used to be so simple, once upon a time.",,"Witches Abroad","Terry Pratchett",1991
"Granny Weatherwax didn't like maps. She felt instinctively that they sold the landscape short.",Granny Weatherwax,"Witches Abroad","Terry Pratchett",1991
"It's a strange thing about determined seekers-after-wisdom that, no matter where they happen to be, they'll always seek that wisdom which is a long way off. Wisdom is one of the few things that looks bigger the further away it is.",,"Witches Abroad","Terry Pratchett",1991
"All witches are very conscious of stories. They can feel stories, in the same way that a bather in a little pool can feel the unexpected trout.",,"Witches Abroad","Terry Pratchett",1991
"Knowing how stories work is almost all the battle.",,"Witches Abroad","Terry Pratchett",1991
"The wages of sin is death but so is the salary of virtue, and at least the evil get to go home early on Fridays.",,"Witches Abroad","Terry Pratchett",1991
"You can't go around building a better world for people. Only people can build a better world for people. Otherwise it's just a cage.",,"Witches Abroad","Terry Pratchett",1991
"Don't you talk to me about progress. Progress just means bad things happen faster.",,"Witches Abroad","Terry Pratchett",1991
"Magic's far too important to be used for rulin' people.",,"Witches Abroad","Terry Pratchett",1991
"We're the kind that gives people what they know they really need, not what we think they ought to want.",Granny Weatherwax,"Witches Abroad","Terry Pratchett",1991
"Good and bad is tricky. I ain't too certain about where people stand. Perhaps what matters is which way you face.",,"Witches Abroad","Terry Pratchett",1991
"You can't force love. If it is there, you've got to do whatever it takes to protect the ones you love.","Rose Hathaway","Frostbite","Richelle Mead","2008"
"You will lose what you value most, so treasure it while you can.","Rhonda","","Vampire Academy","2007"
"I set off, off to kill the man I loved.","Rose Hathaway","Vampire Academy","Richelle Mead","2007"
"It was memories like that that made it so hard to comprehend the quest to kill him. At the same time, I had to destroy him to remember him as the man who loved me.","Rose Hathaway","Blood Promise","Richelle Mead","2010"
"'Twas brillig and the slithy toves, Did gyre and gimble in the wabe; All mimsy were the borogoves, And the mome raths outgrabe.",,Through the Looking-Glass, and What Alice Found There,Lewis Carroll,1871
"Beware the Jabberwock, my son, the jaws that bite and claws that scratch...",,Through the Looking-Glass, and What Alice Found There,Lewis Carroll,1871
"He chortled in his joy.",,Through the Looking-Glass, and What Alice Found There,Lewis Carroll,1871
"It's a poor sort of memory that only works backwards.",Queen,Through the Looking-Glass, and What Alice Found There,Lewis Carroll,1871
"When I use a word, it means just what I choose it to mean — neither more nor less.",Humpty Dumpty,Through the Looking-Glass, and What Alice Found There,Lewis Carroll,1871
"Life, what is it but a dream.",,Through the Looking-Glass, and What Alice Found There,Lewis Carroll,1871
"When you've once said a thing, that fixes it, and you must take the consequences.",Red Queen,Through the Looking-Glass, and What Alice Found There,Lewis Carroll,1871
A man may do both. For not we but those who come after will make the legends of our time.",Aragorn,The Two Towers,J. R. R. Tolkien,1954
"Good and ill have not changed since yesteryear; nor are they one thing among Elves and Dwarves and another among Men.",Aragorn,The Two Towers,J. R. R. Tolkien,1954
"There are some things that it is better to begin than to refuse, even though the end may be dark.",Aragorn,The Two Towers,J. R. R. Tolkien,1954
"Do not be hasty, that is my motto.",Treebeard,The Two Towers,J. R. R. Tolkien,1954
"Many of those trees were my friends, creatures I had known from nut and acorn; many had voices of their own that are lost for ever now.",Treebeard,The Two Towers,J. R. R. Tolkien,1954
"Yes, I am white now. Indeed I am Saruman, one might almost say, Saruman as he should have been.",Gandalf,The Two Towers,J. R. R. Tolkien,1954
"I was talking aloud to myself. A habit of the old: they choose the wisest person present to speak to.",Gandalf,The Two Towers,J. R. R. Tolkien,1954
"It is a comfort not to be mistaken at all points. Do I not know it only too well!",Gandalf,The Two Towers,J. R. R. Tolkien,1954
"I threw down my enemy, and he fell from the high place and broke the mountain-side where he smote it in his ruin.",Gandalf,The Two Towers,J. R. R. Tolkien,1954
"Where now the horse and the rider? Where is the horn that was blowing?",,The Two Towers,J. R. R. Tolkien,1954
"We are all friends here. Or should be; for the laughter of Mordor will be our only reward, if we quarrel.",Gandalf,The Two Towers,J. R. R. Tolkien,1954
"Yet in doubt a man of worth will trust to his own wisdom.",Háma,The Two Towers,J. R. R. Tolkien,1954
"Faithful heart may have froward tongue.",Théoden,The Two Towers,J. R. R. Tolkien,1954
"To crooked eyes truth may wear a wry face.",Gandalf,The Two Towers,J. R. R. Tolkien,1954
"I have lived to see strange days. Long we have tended our beasts and our fields, built our houses, wrought our tools, or ridden away to help in the wars of Minas Tirith.",,The Two Towers,J. R. R. Tolkien,1954
"The treacherous are ever distrustful.",Gandalf,The Two Towers,J. R. R. Tolkien,1954
"Behold, I am not Gandalf the Grey, whom you betrayed. I am Gandalf the White, who has returned from death.",Gandalf,The Two Towers,J. R. R. Tolkien,1954
"Often does hatred hurt itself!",,The Two Towers,J. R. R. Tolkien,1954
"There is nothing that Sauron cannot turn to evil uses.",,The Two Towers,J. R. R. Tolkien,1954
"Be not too eager to deal out death in the name of justice, fearing for your own safety. Even the wise cannot see all ends.",,The Two Towers,J. R. R. Tolkien,1954
"I would not snare even an orc with a falsehood.",Faramir,The Two Towers,J. R. R. Tolkien,1954
"For myself, I would see the White Tree in flower again in the courts of the kings, and the Silver Crown return, and Minas Tirith in peace.",Faramir,The Two Towers,J. R. R. Tolkien,1954
"War must be, while we defend our lives against a destroyer who would devour all; but I do not love the bright sword for its sharpness, nor the arrow for its swiftness, nor the warrior for his glory. I love only that which they defend.",Faramir,The Two Towers,J. R. R. Tolkien,1954
"The praise of the praiseworthy is above all rewards.",,The Two Towers,J. R. R. Tolkien,1954
"They cannot conquer forever!",,The Two Towers,J. R. R. Tolkien,1954
"Despair had not left him, but the weakness had passed. He even smiled grimly, feeling now as clearly as a moment before he had felt the opposite, that what he had to do, he had to do, if he could.",,The Two Towers,J. R. R. Tolkien,1954
"The brave things in the old tales and songs, Mr. Frodo: adventures, as I used to call them. I used to think that they were things the wonderful folk of the stories went out and looked for, because they wanted them, because they were exciting and life was a bit dull.",Samwise,The Two Towers,J. R. R. Tolkien,1954
"I wonder if we shall ever be put into songs or tales. We're in one, of course; but I mean: put into words, you know, told by the fireside, or read out of a great big book with red and black letters, years and years afterwards.",Samwise,The Two Towers,J. R. R. Tolkien,1954
"Even Gollum might be good in a tale, better than he is to have by you, anyway... I wonder if he thinks he's the hero or the villain?",Samwise,The Two Towers,J. R. R. Tolkien,1954
""There is no such thing as a moral or an immoral book. Books are well written, or badly written. That is all."",Preface,The Picture of Dorian Gray,Oscar Wilde,1890
""Experience was of no ethical value. It was merely the name men gave to their mistakes."",Lord Henry,The Picture of Dorian Gray,Oscar Wilde,1890
""To influence a person is to give him one's own soul."",Lord Henry,The Picture of Dorian Gray,Oscar Wilde,1890
""Nowadays people know the price of everything and the value of nothing."",Lord Henry,The Picture of Dorian Gray,Oscar Wilde,1890
""Beauty is a form of genius - is higher, indeed, than genius, as it needs no explanation."",Lord Henry,The Picture of Dorian Gray,Oscar Wilde,1890
""The only way to get rid of a temptation is to yield to it."",Lord Henry,The Picture of Dorian Gray,Oscar Wilde,1890
""Behind every exquisite thing that existed, there was something tragic."",Lord Henry,The Picture of Dorian Gray,Oscar Wilde,1890
""Each of us has heaven and hell in him."",,The Picture of Dorian Gray,Oscar Wilde,1890
""To define is to limit."",,The Picture of Dorian Gray,Oscar Wilde,1890
""The books that the world calls immoral are books that show the world its own shame."",,The Picture of Dorian Gray,Oscar Wilde,1890
""The only way to get rid of a temptation is to yield to it."",Lord Henry,The Picture of Dorian Gray,Oscar Wilde,1890
"All children except one grow up.",,"Peter Pan",J. M. Barrie,1911
"To die will be an awfully big adventure.",Peter Pan,"Peter Pan",J. M. Barrie,1911
"Second to the right and then straight on till morning.",Peter Pan,"Peter Pan",J. M. Barrie,1911
"I'm youth I'm joy I'm a little bird that has broken out of the egg.",Peter Pan,"Peter Pan",J. M. Barrie,1911
"Do you believe in fairies? Say quick that you believe!",Peter Pan,"Peter Pan",J. M. Barrie,1911
"When the first baby laughed for the first time its laugh broke into a thousand pieces and they all went skipping about and that was the beginning of fairies.",Peter Pan,"Peter Pan",J. M. Barrie,1911
"You just think lovely wonderful thoughts and they lift you up in the air.",Peter Pan,"Peter Pan",J. M. Barrie,1911
"Do you know why swallows build in the eaves of houses? It is to listen to the stories.",Peter Pan,"Peter Pan",J. M. Barrie,1911
"I want always to be a little boy and to have fun.",Peter Pan,"Peter Pan",J. M. Barrie,1911
"Of all delectable islands the Neverland is the snuggest and most compact not large and sprawly with tedious distances between one adventure and another but nicely crammed.",,"Peter Pan",J. M. Barrie,1911
"Nothing can harm us after the night-lights are lit they are the eyes a mother leaves behind her to guard her children.",Mrs. Darling,"Peter Pan",J. M. Barrie,1911
"Wendy one girl is more use than twenty boys.",Peter Pan,"Peter Pan",J. M. Barrie,1911
"This is my favorite book in all the world, though I have never read it.",,"The Princess Bride","William Goldman","1973"
"Has it got any sports in it?","The Boy","The Princess Bride","William Goldman","1973"
"Fencing. Fighting. Torture. Poison. True love. Hate. Revenge. Giants. Hunters. Bad men, Good men. Beautifulest ladies. Snakes. Spiders. Beasts of all natures and descriptions. Pain. Death. Brave men, Cowardly men. Strongest men. Chases. Escapes. Lies. Truths. Passion. Miracles.","The Father","The Princess Bride","William Goldman","1973"
"Do I love you? My God, if your love were a grain of sand, mine would be a universe of beaches!","Westley","The Princess Bride","William Goldman","1973"
"As you wish","Westley","The Princess Bride","William Goldman","1973"
"Never go in against a Sicilian when death is on the line.","Vizzini","The Princess Bride","William Goldman","1973"
"There's different kinds of dead: there's sort of dead, mostly dead, and all dead. This fella here, he's only sort of dead.","Miracle Max","The Princess Bride","William Goldman","1973"
"Hello. My name is Inigo Montoya. You killed my father. Prepare to die.","Inigo Montoya","The Princess Bride","William Goldman","1973"
"To the pain means this: if we duel and you win, death for me. If we duel and I win, life for you. But life on my terms.","Westley","The Princess Bride","William Goldman","1973"
"Not if we promise to outlive each other, and I make that promise now.","Westley","The Princess Bride","William Goldman","1973"
""There is no such thing as a moral or an immoral book. Books are well written, or badly written. That is all."",Preface,The Picture of Dorian Gray,Oscar Wilde,1890
""Experience was of no ethical value. It was merely the name men gave to their mistakes."",Lord Henry,The Picture of Dorian Gray,Oscar Wilde,1890
""To influence a person is to give him one's own soul."",Lord Henry,The Picture of Dorian Gray,Oscar Wilde,1890
""Nowadays people know the price of everything and the value of nothing."",Lord Henry,The Picture of Dorian Gray,Oscar Wilde,1890
""Beauty is a form of genius - is higher, indeed, than genius, as it needs no explanation."",Lord Henry,The Picture of Dorian Gray,Oscar Wilde,1890
""Dorian is far too wise not to do foolish things now and then, my dear Basil."",Lord Henry,The Picture of Dorian Gray,Oscar Wilde,1890
""Whenever a man does a thoroughly stupid thing, it is always from the noblest motives."",Lord Henry,The Picture of Dorian Gray,Oscar Wilde,1890
""The only way to get rid of a temptation is to yield to it."",Lord Henry,The Picture of Dorian Gray,Oscar Wilde,1890
""Behind every exquisite thing that existed, there was something tragic."",Lord Henry,The Picture of Dorian Gray,Oscar Wilde,1890
""Each of us has heaven and hell in him."",,The Picture of Dorian Gray,Oscar Wilde,1890
""To define is to limit."",,The Picture of Dorian Gray,Oscar Wilde,1890
""The books that the world calls immoral are books that show the world its own shame."",,The Picture of Dorian Gray,Oscar Wilde,1890
"Families are messy. Immortal families are eternally messy. Sometimes the best we can do is to remind each other that we're related for better or for worse... and try to keep the maiming and killing to a minimum.","Hermes","The Sea of Monsters","Rick Riordan",2006
"Be careful of love. It'll twist your brain around and leave you thinking up is down and right is wrong.","Hephaestus","The Battle of the Labyrinth","Rick Riordan",2008
"It isn't easy being a brilliant inventor. Always alone. Always misunderstood.","Hephaestus","The Battle of the Labyrinth","Rick Riordan",2008
"Your fatal flaw is personal loyalty. To save a friend, you would sacrifice the world.","Athena","The Titan's Curse","Rick Riordan",2007
"Because Hope survives best at the hearth. Guard it for me and I won't be tempted to give up again.","Percy Jackson","The Last Olympian","Rick Riordan",2009
"I am never, ever going to make things easy for you, Seaweed Brain. Get used to it.","Annabeth Chase","The Last Olympian","Rick Riordan",2009
"If my life is going to mean anything, I have to live it myself.","Percy Jackson","The Lightning Thief","Rick Riordan",2005
"Even strength must bow to wisdom sometimes.","Annabeth Chase","The Lightning Thief","Rick Riordan",2005
"The real world is where the monsters are.","Percy Jackson","The Lightning Thief","Rick Riordan",2005
"Go on with what your heart tells you, or you will lose all.","The Oracle","The Lightning Thief","Rick Riordan",2005
"Deadlines just aren't real to me until I'm staring one in the face.","Percy Jackson","The Last Olympian","Rick Riordan",2009
"You hit the Lord of the Titans in the eye with a blue plastic hairbrush.","Annabeth Chase","The Last Olympian","Rick Riordan",2009
"Nothing like watching your relatives fight, I always say.","Hermes","The Battle of the Labyrinth","Rick Riordan",2008
"Knowing too much of your future is never a good thing.","Chiron","The Lightning Thief","Rick Riordan",2005
"Life is only precious because it ends, kid.","Leo Valdez","The Blood of Olympus","Rick Riordan",2014
"Getting something and having the wits to use it... those are two different things.","Athena","The Titan's Curse","Rick Riordan",2007
"Even heroes have the right to be sad.","Poseidon","The Last Olympian","Rick Riordan",2009
"People are more difficult to work with than machines. And when you break a person, he can't be fixed.","Hephaestus","The Battle of the Labyrinth","Rick Riordan",2008
"The world was collapsing, and the only thing that really mattered to me was that she was alive.","Percy Jackson","The Last Olympian","Rick Riordan",2009
"You must forge your own path for it to mean anything.","Hera","The Lost Hero","Rick Riordan",2010
"The most dangerous flaws are those which are good in moderation.","Rachel Dare","The Last Olympian","Rick Riordan",2009
"The sea does not like to be restrained.","Percy Jackson","The Lightning Thief","Rick Riordan",2005
"Humans see what they want to see.","Chiron","The Lightning Thief","Rick Riordan",2005
"Fairness does not mean everyone gets the same. Fairness means everyone gets what they need.","Leo Valdez","The Lost Hero","Rick Riordan",2010
"You can't give up on your family, no matter how tempting they make it.","Hermes","The Sea of Monsters","Rick Riordan",2006
"Knowing yourself is the beginning of all wisdom.","Athena","The Titan's Curse","Rick Riordan",2007
"Heroes are never perfect. But they're brave, they're authentic, they're courageous, determined, discreet, and they've got grit.","Piper McLean","The Lost Hero","Rick Riordan",2010
"We're staying together. You're not getting away from me. Never again.","Percy Jackson","The Mark of Athena","Rick Riordan",2012
"It's hard to enjoy practical jokes when your whole life feels like one.","Percy Jackson","The Last Olympian","Rick Riordan",2009
"Even in death, my monsters do not rest. They will remember you, Percy Jackson.","Kronos","The Last Olympian","Rick Riordan",2009
"All I care about is keeping you safe. Don't you understand?","Annabeth Chase","The Last Olympian","Rick Riordan",2009
"With great power... comes great need to take a nap. Wake me up later.","Nico di Angelo","The Last Olympian","Rick Riordan",2009
"Can't you nudge them to fight a little nicer?","Percy Jackson","The Last Olympian","Rick Riordan",2009
"Even the bravest can fall.","Athena","The Titan's Curse","Rick Riordan",2007
"Sometimes the hardest power to master is the power of yielding.","Hestia","The Last Olympian","Rick Riordan",2009
"Let us find the dam snack bar.","Zoë Nightshade","The Titan's Curse","Rick Riordan",2007
"You are okay? Not eaten by monsters?","Tyson","The Battle of the Labyrinth","Rick Riordan",2008
"Love is on every side, and no one's side. Don't ask what Love can do for you.","Cupid","The House of Hades","Rick Riordan",2013
"Nothing is unfixable.","Leo Valdez","The Blood of Olympus","Rick Riordan",2014
"How did you die?""We er... drowned in a bathtub.""All three of you?""It was a big bathtub.","Percy Jackson and the Stoll brothers","The Titan's Curse","Rick Riordan",2007
"Gods of Olympus, I hate it when he does that.","Percy Jackson","The Lightning Thief","Rick Riordan",2005
"Wow, when he invents a lie, he does it with style.","Leo Valdez","The Lost Hero","Rick Riordan",2010
"I figure the universe is basically like a machine. I don't know who made it, but it chugs along okay as long as you keep it well oiled.","Leo Valdez","The Lost Hero","Rick Riordan",2010
"Chocolate is good. Everything else is questionable.","Coach Hedge","The House of Hades","Rick Riordan",2013
"You promised you would protect her. You promised.","Nico di Angelo","The Last Olympian","Rick Riordan",2009
"Being a hero doesn't mean you're invincible. It just means that you're brave enough to stand up and do what's needed.","Piper McLean","The Lost Hero","Rick Riordan",2010
"It's funny how humans can wrap their mind around things and fit them into their version of reality.","Percy Jackson","The Lightning Thief","Rick Riordan",2005
"I try not to think. It interferes with being nuts.","Leo Valdez","The Mark of Athena","Rick Riordan",2012
"Nothing like a reformed kleptomaniac for stealing back stolen stuff.","Percy Jackson","The Sea of Monsters","Rick Riordan",2006
"Appearances can be deceiving.","Chiron","The Lightning Thief","Rick Riordan",2005
"Knowing too much of your future is never a good thing.","Chiron","The Lightning Thief","Rick Riordan",2005
"I have been on that quest you said for a tutor, and I have found him. He is a great magician.",Wart,The Sword in the Stone,T. H. White,1938
"I unfortunately was born at the wrong end of time, and I have to live backwards from in front, while surrounded by a lot of people living forwards from behind.",Merlyn,The Sword in the Stone,T. H. White,1938
"You are young, and do not understand these things. But you will learn that owls are the most courteous, single-hearted and faithful creatures living.",Merlyn,The Sword in the Stone,T. H. White,1938
"Everything not forbidden is compulsory",,The Once and Future King,T. H. White,1958
"I would do anything for King Arthur.",Sir Thomas of Warwick,The Candle in the Wind,T. H. White,1958
"Don't ever let anybody teach you to think, Lance: it is the curse of the world.",Arthur,The Ill-Made Knight,T. H. White,1940
"If people reach perfection they vanish, you know.",Arthur,The Ill-Made Knight,T. H. White,1940
"But there was a time when each of us stood naked before the world, confronting life as a serious problem with which we were intimately and passionately concerned.",Arthur,The Ill-Made Knight,T. H. White,1940
